department,amount,user,category,opened_at,type,number,processed_date,source_id,state,short_description,ci
Customer Support,1819,Janice Twiet,Assets,2023-02-11 09:22:00,,EXP00000453,2023-02-26 09:08:56.827768641,,Processed,Automatically generated asset line for creation of hardware,Dell Latitude 5410
Sales,1302,Nadia Wilshire,Services,2023-06-17 14:56:00,,EXP00000454,2023-06-29 09:01:24.608388061,,Processed,Provision of cloud storage service,AWS S3 Bucket
Customer Support,1838,Danny Dales,Services,2023-11-12 21:20:00,,EXP00000455,2023-11-16 23:19:05.988651254,,Processed,Automatically generated asset for creation of Service,IT Consulting Service 07
Sales,1028,Essie Vaill,Miscellaneous,2024-02-02 23:09:00,,EXP00000456,,,Pending,Miscellaneous hardware asset registered,Dell Inspiron 15
Customer Support,1878,Jimmie Kertzman,Services,2023-06-02 20:08:00,,EXP00000457,2023-06-25 00:53:11.522522265,,Processed,Maintenance service for corporate servers,Corporate Server 001
Sales,6844,Essie Vaill,Travel,2023-07-29 17:14:00,,EXP00000458,,,Submitted,Travel equipment asset,Luxury coach bus
IT,6031,Vernon Engelman,Assets,2023-11-29 16:13:00,,EXP00000459,,,Pending,Procurement of new asset,Dell Latitude 7400
Customer Support,5513,Nelly Jakuboski,Travel,2023-07-12 03:20:00,,EXP00000460,,,Submitted,Travel related hardware asset,Dell Latitude 7420 Travel Laptop
Customer Support,810,Petra Mcnichol,Services,2023-03-03 02:06:00,,EXP00000461,,,Pending,ServiceNow instance server configuration,Amazon Web Services
Customer Support,1393,Sal Pindell,Services,2024-04-18 21:30:00,,EXP00000462,2024-04-29 08:51:30.094898522,,Processed,Service-related hardware configuration,Network Service Server Model X
Customer Support,5239,Carmel Overfelt,Assets,2023-05-03 15:01:00,,EXP00000463,2023-05-22 11:36:14.664546304,,Processed,Purchase of new IT hardware asset,Dell Latitude 7490
Customer Support,3668,Darrel Tork,Miscellaneous,2023-11-04 22:51:00,,EXP00000464,2023-11-16 03:10:57.757329300,,Processed,Additional mouse for office use,Dell Wireless Mouse WM326
Customer Support,5875,Marcie Shulz,Assets,2023-06-06 18:43:00,,EXP00000465,2023-06-26 13:15:13.453856378,,Processed,Device Asset Entry: Dell Inspiron Laptop,Dell Inspiron 5593
Customer Support,3819,Helena Suermann,Travel,2024-04-26 18:38:00,,EXP00000466,2024-05-03 23:11:41.330162069,,Processed,Automatically generated expense line for creation of travel asset,Business Travel Suite
Development,3643,Ramon Amaral,Assets,2023-10-26 00:31:00,,EXP00000467,2023-10-26 00:31:00.000000000,,Processed,Asset creation for new Dell workstation,Dell OptiPlex 3070
IT,461,Forest Orea,Services,2023-11-02 09:30:00,,EXP00000468,2023-11-04 09:30:00.000000000,,Processed,Services related hardware item added,Web Server Hardware 01
IT,416,Sadie Rowlett,Services,2023-02-16 12:59:00,,EXP00000469,2023-02-25 08:44:20.485014601,,Processed,Auto-generated service line for new asset,Cloud-based Email Service
HR,1854,Rosalie Krigger,Travel,2023-04-19 18:16:00,,EXP00000470,2023-04-29 08:18:50.580157517,,Processed,Automatically generated travel expense for creation of asset,Travel Ticket First Class
Customer Support,479,Sue Haakinson,Services,2023-09-08 04:46:00,,EXP00000471,,,Declined,Automated addition of newly procured service,Cloud Computing Service
Sales,313,Savannah Loffier,Services,2024-01-21 04:28:00,,EXP00000472,,,Declined,Automated creation of Services related asset,Cloud Service Management
Sales,7820,Essie Vaill,Travel,2023-04-02 19:38:00,,EXP00000473,2023-04-11 15:25:05.493252002,,Processed,Travel requisition for new hardware asset,Dell Latitude E7470
Customer Support,3319,Janice Twiet,Miscellaneous,2024-03-22 19:26:00,,EXP00000474,2024-03-24 19:26:00.000000000,,Processed,Purchase of miscellaneous office hardware,Dell OptiPlex 3080 Micro Desktop
Customer Support,7033,Sal Pindell,Assets,2023-07-09 03:05:00,,EXP00000475,2023-07-11 03:05:00.000000000,,Processed,Asset generation for information technology inventory,Dell Latitude 7290
Customer Support,1844,Marianne Earman,Assets,2024-03-12 12:40:00,,EXP00000476,2024-03-17 17:56:18.995361856,,Processed,Automatically generated asset entry for new hardware,Dell Latitude 3410
Finance,3006,Germaine Bruski,Travel,2023-06-23 03:18:00,,EXP00000477,2023-06-30 22:38:48.726055996,,Processed,Purchase of Travel-specific hardware,Lenovo ThinkPad X1 Carbon
Customer Support,6492,Jimmie Kertzman,Assets,2023-08-18 19:09:00,,EXP00000478,2023-09-04 06:03:22.094556868,,Processed,Asset registration for new hardware,Dell Latitude 5510
Customer Support,3168,Ofelia Sheffler,Travel,2023-12-22 10:20:00,,EXP00000479,2024-01-05 07:30:00.667161315,,Processed,Automatically generated expense line for creation of Travel App asset,TGlobal Travel Management System 5.0
Customer Support,2210,Felipe Mahone,Assets,2024-01-11 22:05:00,,EXP00000480,2024-01-24 05:53:40.585373814,,Processed,New entry for asset tracking: Dell Latitude E5470,Dell Latitude E5470
Sales,7390,Melody Saddat,Assets,2023-12-22 17:31:00,,EXP00000481,,,Declined,Newly added Asset in System - Server,Dell PowerEdge R740
Sales,2684,Rob Woodbyrne,Travel,2024-02-12 18:29:00,,EXP00000482,,,Pending,Expensed travel equipment,International AC Adapter Kit
Development,2786,Cyril Behen,Assets,2023-08-18 13:26:00,,EXP00000483,2023-08-19 13:26:00.000000000,,Processed,Asset registration of new printer,HP Officejet Pro 8600
Customer Support,1764,Misty Ericksen,Assets,2023-02-04 18:49:00,,EXP00000484,2023-02-23 23:32:57.208167151,,Processed,Acquisition of new IT asset,Dell Precision 7540
Sales,1242,Nadia Wilshire,Services,2023-02-19 08:27:00,,EXP00000485,2023-03-06 22:15:06.821115483,,Processed,Provisioning of new cloud service,Azure Cloud Service
Customer Support,1215,Mitzi Ihenyen,Miscellaneous,2023-08-05 01:43:00,,EXP00000486,2023-08-09 22:53:28.825535186,,Processed,Automatically generated asset line for creation of miscellaneous item,Virtual Reality Headset Oculus Rift
Customer Support,2489,Ofelia Sheffler,Miscellaneous,2023-02-07 04:07:00,,EXP00000487,,,Declined,Miscellaneous Hardware Asset,Dell Monitor 27
Customer Support,1843,Owen Sparacino,Miscellaneous,2023-03-11 01:40:00,,EXP00000488,,,Pending,ServiceNow Asset: Miscellaneous Hardware Component,Dell Precision T3500
Customer Support,1147,Nelly Jakuboski,Services,2023-07-07 04:41:00,,EXP00000489,2023-07-09 04:41:00.000000000,,Processed,Asset associated with Service Delivery,Cloud Service Platform
Customer Support,1644,Darrel Tork,Services,2023-03-17 18:46:00,,EXP00000490,2023-04-11 03:38:45.682665955,,Processed,Service Delivery Application (Standard) as Assets,ServiceNow Cloud Service
Sales,6310,Essie Vaill,Travel,2023-07-08 18:46:00,,EXP00000491,2023-07-11 12:16:07.107207748,,Processed,Travel related asset generation,Airline Ticket
Sales,4643,Bertie Luby,Miscellaneous,2024-02-19 19:28:00,,EXP00000492,2024-02-29 23:54:34.139067091,,Processed,Miscellaneous inventory item added,Tripod stand model 457
Sales,649,Nadia Wilshire,Travel,2024-01-24 14:21:00,,EXP00000493,2024-01-26 17:39:36.410688523,,Processed,Automatically generated expense line for travel asset,Travel Equipment 20
Customer Support,323,Zackary Mockus,Travel,2023-10-01 05:50:00,,EXP00000494,2023-10-12 09:37:52.848439402,,Processed,Expense for travel equipment purchase,Travel Bag
Sales,4144,Carolina Kinlaw,Miscellaneous,2024-04-21 05:47:00,,EXP00000495,2024-04-26 11:27:52.639934638,,Processed,Automatically created entry for miscellaneous asset item,Projector Epson X2
Customer Support,3812,Wilfredo Gidley,Assets,2023-09-28 11:58:00,,EXP00000496,,,Declined,Purchase of new hardware asset,Dell Latitude 7420
Customer Support,1557,Sal Pindell,Services,2023-08-19 22:49:00,,EXP00000497,2023-09-11 16:13:48.318541731,,Processed,Automatically generated service line for creation of asset,Cloud Computing Services
Customer Support,6008,Zackary Mockus,Travel,2024-04-20 07:21:00,,EXP00000498,2024-05-05 18:40:58.287738875,,Processed,Automatically generated expense line for Travel related hardware asset,Travel Laptop Dell Vostro
Sales,1368,Luella Pliner,Services,2023-08-11 05:08:00,,EXP00000499,2023-08-18 04:30:35.577428113,,Processed,Purchase of cloud service hosting,Amazon Web Services
