start_date,priority,metric,target_percentage,department,percent_complete,end_date,state,category,owner,sys_updated_by,sys_id,description
2022-03-09,Medium,Employee Turnover Rate,58,Finance,7,2022-04-25,In Progress,Cost Reduction,Logan Muhl,admin,G000000,"Reduce operational expenses by optimizing energy consumption across all facilities, aiming to cut energy costs by 20% from last fiscal year's figures."
2022-04-23,High,Sales Increase,57,Finance,87,2022-11-23,Completed,Revenue Growth,Gisela Kosicki,admin,G000001,Increase annual subscription sales by 20% by expanding into three new international markets.
2022-12-16,Medium,Survey Score,66,HR,60,2023-10-20,In Progress,Efficiency,Ramon Amaral,admin,G000002,"Optimize IT support workflows to reduce ticket resolution time by 30%, thereby increasing overall operational efficiency."
2022-10-08,High,Employee Turnover Rate,87,Marketing,89,2023-06-02,Completed,Customer Satisfaction,Jacinto Gawron,admin,G000003,Increase the customer satisfaction score from 75 to 85 by enhancing support response time and personalized customer interactions over the next quarter.
2022-10-26,High,Expense Ratio,93,HR,12,2023-09-13,In Progress,Efficiency,Renae Eldrige,admin,G000004,"Enhance software deployment process to reduce average setup time by 30%, aiming to improve overall employee productivity."
2022-07-05,High,Survey Score,98,HR,49,2022-09-29,Planned,Customer Satisfaction,Mildred Gallegas,admin,G000005,Develop a comprehensive customer feedback system to increase overall satisfaction ratings by 20% over the next fiscal year.
2022-07-10,Low,Employee Turnover Rate,77,Finance,13,2023-01-04,In Progress,Revenue Growth,Security Center Data Collection User,admin,G000006,Increase annual revenue from product sales by 20% through expanding into three new international markets by Q4.
2022-10-15,Low,Expense Ratio,76,Finance,23,2023-09-03,In Progress,Customer Satisfaction,Devon Teston,admin,G000007,Enhance the online support portal to improve resolution times and increase customer satisfaction scores by 20% over the next quarter.
2022-05-06,High,Sales Increase,91,Finance,26,2022-11-06,In Progress,Customer Satisfaction,Rosalia Kennemur,admin,G000008,Enhance the customer support portal to improve user experience and increase customer satisfaction ratings by 20% over the next quarter.
2022-09-24,High,Expense Ratio,76,Finance,23,2023-04-24,In Progress,Revenue Growth,Eva Seahorn,admin,G000009,Increase annual sales revenue by 20% through strategic marketing campaigns and expansion into new regional markets.
2022-08-31,Medium,Survey Score,72,Finance,61,2022-09-24,Cancelled,Cost Reduction,Bridget Knightly,admin,G000010,"Optimize IT asset management to decrease operational expenditure by 20%, thus saving approximately $120,000 annually."
2022-04-18,Medium,Expense Ratio,78,Marketing,4,2022-09-26,In Progress,Employee Satisfaction,Savannah Kesich,admin,G000011,"Increase employee satisfaction scores by implementing monthly feedback sessions and enhancing workplace environment, aiming for a 20% improvement in survey results over the next quarter."
2022-12-18,Low,Expense Ratio,64,Finance,40,2023-07-11,In Progress,Revenue Growth,Maurine Monroy,admin,G000012,Increase annual subscription sales by 20% through enhanced marketing strategies and customer engagement programs.
2022-06-10,High,Employee Turnover Rate,62,Marketing,40,2022-12-04,In Progress,Efficiency,SOAP Guest,admin,G000013,"Optimize IT ticket resolution flow to increase response time efficiency by 25%, reducing average ticket resolution from 4 hours to 3 hours."
2022-10-01,High,Employee Turnover Rate,55,Finance,98,2022-11-15,Completed,Cost Reduction,Rachel Larrison,admin,G000014,Optimize software licensing arrangements to achieve a 20% reduction in IT spending over the next fiscal year.
2022-01-26,Low,Sales Increase,98,Finance,72,2022-06-05,In Progress,Employee Satisfaction,Cary Mccamey,admin,G000015,Develop and launch a comprehensive wellness program aimed at boosting employee satisfaction by 20% through improved mental health resources and flexible working conditions.
2022-04-22,Critical,Expense Ratio,55,IT,43,2022-08-25,Cancelled,Employee Satisfaction,Suresh Yekollu,admin,G000016,Launch a quarterly feedback survey initiative to boost employee satisfaction and engagement by 20% by the end of the fiscal year.
2022-03-25,High,Employee Turnover Rate,66,Finance,37,2022-05-22,In Progress,Cost Reduction,Sandra Graen,admin,G000017,Optimize IT service expenditures to achieve a 20% budget cut within the next fiscal year through negotiated vendor contracts and eliminating redundant software licenses.
2022-12-11,Low,Survey Score,99,IT,23,2023-01-26,In Progress,Employee Satisfaction,Timothy Janski,admin,G000018,Enhance the employee workspace environment to improve overall satisfaction ratings by at least 20% by the end of the fiscal year.
2022-02-12,Low,Employee Turnover Rate,86,Marketing,95,2022-06-25,Completed,Employee Satisfaction,Sandra Graen,admin,G000019,"Develop and execute an annual employee satisfaction survey to identify areas for improvement, aiming to improve overall employee satisfaction scores by 20% over the next fiscal year."
2022-04-10,High,Employee Turnover Rate,97,Finance,24,2022-04-28,In Progress,Cost Reduction,survey user,admin,G000020,"Reduce operational expenses by optimizing energy usage across all company sites, aiming for a 20% cost saving within the next fiscal year."
2022-04-07,Medium,Employee Turnover Rate,94,HR,48,2022-08-15,In Progress,Revenue Growth,Billie Cowley,admin,G000021,"Increase overall sales revenue by launching two new product lines by the end of Q4, targeting a 20% increase in market share."
2022-03-17,Critical,Sales Increase,83,HR,83,2022-04-28,Completed,Employee Satisfaction,Derek Kreutzbender,admin,G000022,Develop and execute an annual employee engagement survey to increase overall satisfaction scores by 20% over the next fiscal year.
2022-01-19,Low,Expense Ratio,60,Finance,32,2022-11-17,Cancelled,Revenue Growth,SOAP Guest,admin,G000023,"Increase annual software subscription sales by 20%, targeting a revenue growth from $500K to $600K through strategic marketing and customer engagement initiatives."
2022-09-05,Critical,Survey Score,81,IT,53,2022-10-26,Planned,Cost Reduction,Tammie Schwartzwalde,admin,G000024,"Reduce software licensing expenses by optimizing and eliminating redundant applications, aiming for a 20% cost reduction within the next fiscal year."
2022-10-25,Low,Sales Increase,56,HR,24,2023-07-01,In Progress,Revenue Growth,Kathleen Beresnyak,admin,G000025,Develop and launch a new software product line aimed at increasing company-wide revenue by 20% over the next fiscal year.
2022-09-01,Low,Survey Score,96,IT,88,2023-04-28,In Progress,Revenue Growth,Maurine Monroy,admin,G000026,Expand into three new regional markets to achieve a 20% increase in overall sales revenue within the next fiscal year.
2022-08-07,High,Survey Score,97,IT,64,2023-05-24,In Progress,Efficiency,Ramon Amaral,admin,G000027,Enhance the system's processing power by automating routine tasks which is expected to cut down the operation time by 30%.
2022-05-03,High,Survey Score,95,Marketing,39,2022-11-08,In Progress,Employee Satisfaction,Allyson Gillispie,admin,G000028,"Develop and launch a new employee engagement program focused on career development and training, aiming to improve employee satisfaction scores by 20% in the next annual survey."
2022-04-16,High,Employee Turnover Rate,86,IT,26,2022-08-22,In Progress,Revenue Growth,Beverley Bunche,admin,G000029,Develop and launch a new software product line aimed at small businesses to increase overall company revenue by 20% within the next fiscal year.
2022-11-30,Medium,Employee Turnover Rate,78,Finance,52,2023-06-05,Cancelled,Customer Satisfaction,Karen Flierl,admin,G000030,Develop a new customer feedback system to increase overall satisfaction ratings by 20% over the next 12 months.
2022-12-04,Low,Expense Ratio,88,IT,62,2023-09-04,In Progress,Revenue Growth,Karyn Jinks,admin,G000031,Expand market reach by enhancing our digital advertising strategies aiming for a 25% increase in online sales revenue within the next fiscal year.
2022-06-08,Low,Employee Turnover Rate,50,Marketing,98,2022-10-02,Completed,Revenue Growth,Karen Flierl,admin,G000032,Develop new digital marketing strategies to increase online sales revenue by 20% over the next fiscal quarter.
2022-07-08,High,Expense Ratio,89,Finance,27,2022-08-30,In Progress,Cost Reduction,Lora Lendor,admin,G000033,Reduce overall IT spending by 10% through optimizing software licensing and hardware maintenance contracts.
2022-04-04,Low,Employee Turnover Rate,88,Finance,23,2022-05-09,In Progress,Cost Reduction,Corinne Cowan,admin,G000034,"Reduce overall IT infrastructure costs by consolidating vendor contracts and optimizing resource usage, aiming for a 20% reduction in annual spending."
2022-06-03,Critical,Survey Score,78,HR,58,2022-12-21,In Progress,Efficiency,Travis Brockert,admin,G000035,"Automate the employee onboarding process to reduce the required time by 30%, enhancing overall operational efficiency."
2022-01-07,High,Employee Turnover Rate,69,Finance,25,2022-01-24,Planned,Cost Reduction,Jacinto Gawron,admin,G000036,Achieve a 20% reduction in IT operational expenses by optimizing software licensing and enhancing vendor contract agreements.
2022-07-06,High,Survey Score,61,IT,22,2023-02-05,In Progress,Employee Satisfaction,Gisela Kosicki,admin,G000037,Launch an annual employee engagement survey to identify key areas of improvement in job satisfaction and implement targeted action plans to increase overall employee satisfaction scores by 20% over the next fiscal year.
2022-11-09,High,Expense Ratio,63,Finance,57,2023-03-05,In Progress,Employee Satisfaction,Tammie Schwartzwalde,admin,G000038,Launch a quarterly employee feedback survey to identify key areas for improvement in workplace satisfaction and aim to enhance overall employee happiness by 20%.
2022-12-24,Low,Sales Increase,55,IT,59,2023-08-20,Completed,Efficiency,Savannah Kesich,admin,G000039,"Increase the efficiency of the IT support ticketing system by automating response generation, aiming to shorten response times by 30% in the next quarter."
2022-11-04,Low,Employee Turnover Rate,75,Marketing,22,2023-04-23,In Progress,Efficiency,Rosalia Kennemur,admin,G000040,"Increase the use of automation tools in IT system updates to reduce manual intervention by 30%, thereby decreasing time spent on routine tasks and boosting operational efficiency."
2022-05-26,Low,Employee Turnover Rate,63,Marketing,54,2023-01-06,In Progress,Customer Satisfaction,Beverley Bunche,admin,G000041,"Enhance the customer support portal to improve user experience, aiming to increase customer satisfaction ratings by 20% over the next fiscal year."
2022-10-23,Critical,Employee Turnover Rate,83,Finance,10,2022-11-15,Cancelled,Cost Reduction,Antony Thierauf,admin,G000042,"Reduce operational expenses by optimizing resource allocation and automating routine tasks, aiming for a 20% cost reduction over the next fiscal year."
2022-06-02,High,Sales Increase,70,Finance,98,2022-06-23,Completed,Cost Reduction,Melinda Carleton,admin,G000043,"Develop a new supplier negotiation strategy aiming to decrease materials costs by 20%, thus improving overall profitability margins."
2022-03-08,Critical,Sales Increase,72,HR,85,2022-04-01,Completed,Cost Reduction,Stephen Seiters,admin,G000044,Reduce overall IT operating expenses by 20% through automation and renegotiating vendor contracts.
2022-01-24,Medium,Expense Ratio,90,Finance,16,2022-12-07,In Progress,Customer Satisfaction,Gisela Kosicki,admin,G000045,Develop and implement a new customer feedback system to improve satisfaction ratings by 20% over the next fiscal year.
2022-02-26,High,Sales Increase,81,Marketing,87,2022-10-07,Completed,Revenue Growth,Terrell Rodda,admin,G000046,Develop new strategic partnerships and expand into international markets aiming to increase overall revenue by 20% within the next fiscal year.
2022-07-07,Medium,Employee Turnover Rate,87,HR,49,2023-01-21,Cancelled,Employee Satisfaction,Antony Thierauf,admin,G000047,Launch a quarterly employee feedback survey to identify key areas for improvement in workplace satisfaction and implement targeted initiatives to enhance them.
2022-06-26,Medium,Sales Increase,95,Finance,23,2022-10-25,In Progress,Revenue Growth,Jacinto Gawron,admin,G000048,Increase annual sales revenue by 20% by expanding into three new geographic markets and launching two new product lines.
2022-09-23,Critical,Survey Score,63,HR,92,2023-06-07,Completed,Customer Satisfaction,User 1,admin,G000049,Enhance the online support portal to improve response times and increase customer satisfaction ratings by 20% over the next fiscal year.
2022-11-07,Medium,Survey Score,73,Marketing,39,2023-06-22,In Progress,Revenue Growth,Logan Muhl,admin,G000050,Expand sales outreach to achieve a 20% increase in annual revenue through new regional markets and customer segments.
2022-04-21,Medium,Sales Increase,87,HR,45,2022-06-06,In Progress,Cost Reduction,Renae Eldrige,admin,G000051,"Reduce operational expenses by optimizing energy usage in all corporate offices, aiming to cut utility costs by 20% over the next fiscal year."
2022-03-04,Medium,Sales Increase,60,Marketing,5,2022-09-09,Planned,Revenue Growth,Janet Schaffter,admin,G000052,Increase annual subscription revenue by 20% through strategic marketing campaigns and sales team expansion.
2022-07-13,Critical,Expense Ratio,76,Finance,60,2022-09-07,Planned,Cost Reduction,Jimmie Barninger,admin,G000053,"Reduce overhead costs by optimizing energy usage in all corporate facilities, aiming for a 20% reduction over the next fiscal year."
2022-06-12,Critical,Employee Turnover Rate,92,Finance,18,2022-07-23,In Progress,Cost Reduction,Karyn Jinks,admin,G000054,"Optimize the usage of office supplies across all branches to cut expenses by 20% by the end of Q4, moving from $50K to $40K."
2022-06-15,High,Expense Ratio,53,Finance,1,2022-07-23,In Progress,Cost Reduction,User 1,admin,G000055,Reduce overall IT expenditures by consolidating vendor contracts and negotiating better terms to achieve a 20% cost savings within the next fiscal year.
2022-04-28,High,Survey Score,62,Marketing,75,2022-06-07,Completed,Cost Reduction,Christian Marnell,admin,G000056,"Reduce IT infrastructure costs by optimizing server utilization, aiming for a 20% cost saving over the next fiscal year."
2022-06-24,High,Expense Ratio,99,Finance,10,2023-02-22,In Progress,Employee Satisfaction,Dwayne Maddalena,admin,G000057,Launch a quarterly feedback survey to increase employee satisfaction scores by 20% over the next fiscal year.
2022-08-27,Critical,Expense Ratio,63,IT,42,2023-03-19,In Progress,Customer Satisfaction,Kennith Peto,admin,G000058,Develop and implement a new customer feedback system to increase overall satisfaction ratings by at least 20% over the next fiscal year.
2022-07-27,Medium,Employee Turnover Rate,83,Finance,29,2022-08-23,In Progress,Cost Reduction,Rob Phillips,admin,G000059,"Reduce overall IT infrastructure costs by optimizing server usage and consolidating unused resources, aiming for a 20% cost reduction over the next fiscal year."
2022-01-31,Medium,Employee Turnover Rate,59,Finance,60,2022-05-15,Completed,Employee Satisfaction,Stephen Seiters,admin,G000060,Develop a comprehensive employee wellness program aiming to improve overall job satisfaction rates by 20% within the next fiscal year.
2022-06-18,Critical,Expense Ratio,65,HR,4,2022-09-09,In Progress,Customer Satisfaction,Ramon Amaral,admin,G000061,"Enhance the client support portal to improve user experience, aiming for a 20% increase in customer satisfaction ratings within the next six months."
2022-06-21,High,Expense Ratio,78,IT,17,2023-01-08,In Progress,Customer Satisfaction,Christian Marnell,admin,G000062,Develop a new customer feedback system to increase satisfaction scores by 20% over the next quarter through enhanced service response times and personalized support.
2022-05-08,High,Survey Score,78,Finance,25,2022-07-04,In Progress,Cost Reduction,Sophie Langner,admin,G000063,Reduce IT infrastructure costs by 20% by optimizing server utilization and renegotiating vendor contracts.
2022-12-30,High,Survey Score,81,Marketing,29,2023-05-14,Cancelled,Efficiency,Marcelino Maggs,admin,G000064,"Optimize the IT support ticket system to reduce average resolution time by 20%, aiming for an improvement from 48 to 38 hours."
2022-09-15,Low,Sales Increase,98,Finance,81,2023-03-21,Planned,Efficiency,Doug Matrisciano,admin,G000065,"Enhance the internal software deployment process to reduce time spent on installations and updates by 30%, aiming for a seamless operational flow."
2022-07-16,Low,Sales Increase,97,Marketing,76,2023-02-12,In Progress,Employee Satisfaction,SOAP Guest,admin,G000066,"Conduct quarterly employee engagement surveys to identify areas for improving work environment and satisfaction, aiming to increase overall employee happiness scores by 20%."
2022-10-19,High,Survey Score,75,IT,4,2023-03-25,In Progress,Efficiency,Problem Administrator,admin,G000067,"Increase the automation of report generation tasks by 30%, thereby reducing manual workload and enhancing overall operational efficiency."
2022-07-14,Critical,Survey Score,58,Finance,86,2023-01-03,Completed,Revenue Growth,Sophie Langner,admin,G000068,Develop and launch a new software product aimed at small businesses to increase annual revenue by 20%.
2022-09-05,Low,Survey Score,58,Finance,0,2022-10-01,In Progress,Cost Reduction,Suresh Yekollu,admin,G000069,"Reduce annual software licensing costs by consolidating vendors and negotiating better terms, aiming for a 20% cost saving."
2022-06-24,Medium,Survey Score,89,Finance,58,2022-07-05,In Progress,Cost Reduction,Stephen Seiters,admin,G000070,"Reduce overall operational costs by optimizing energy usage, aiming for a 20% reduction in monthly utility bills from $50K to $40K."
2022-12-20,Medium,Sales Increase,86,HR,0,2023-06-12,In Progress,Revenue Growth,Alyssa Biasotti,admin,G000071,"Develop new digital marketing strategies aimed at increasing customer base by 20%, thereby boosting annual sales revenue."
2022-07-15,Medium,Expense Ratio,81,Finance,16,2022-09-07,In Progress,Cost Reduction,Mamie Mcintee,admin,G000072,"Reduce operational expenses through automation of manual processes, targeting a 20% decrease in overhead costs over the next fiscal year."
2022-08-06,Medium,Employee Turnover Rate,100,IT,9,2023-03-06,In Progress,Employee Satisfaction,Suresh Yekollu,admin,G000073,Develop and launch a new employee engagement program aimed at improving workplace culture and increasing overall satisfaction scores by 20%.
2022-02-24,Medium,Survey Score,70,HR,27,2022-10-19,In Progress,Efficiency,Nirali Patel,admin,G000074,"Enhance the automated ticketing system to reduce average resolution time by 20%, aiming to boost overall customer service efficiency."
2022-08-18,High,Expense Ratio,54,Finance,2,2022-11-23,In Progress,Efficiency,Eva Seahorn,admin,G000075,"Optimize internal workflows to reduce average task completion time by 20%, increasing overall operational efficiency."
2022-04-20,Critical,Employee Turnover Rate,97,HR,48,2022-12-08,In Progress,Efficiency,Kennith Peto,admin,G000076,"Optimize the IT ticket handling process to decrease response time by 20%, aiming to boost overall user satisfaction and operational efficiency."
2022-08-18,High,Expense Ratio,52,Finance,45,2022-08-31,In Progress,Cost Reduction,Password Admin,admin,G000077,Optimize IT infrastructure to decrease overall operating expenses by 20% over the next fiscal year.
2022-02-12,Medium,Survey Score,73,Finance,79,2022-07-27,Completed,Customer Satisfaction,Antony Thierauf,admin,G000078,Develop a customer feedback system to improve satisfaction ratings by 20% over the next fiscal year through enhanced service response times and personalized support.
2022-05-26,Critical,Survey Score,88,Marketing,15,2022-10-16,In Progress,Employee Satisfaction,Miquel Demicco,admin,G000079,Develop and implement a quarterly team-building program aimed at boosting employee morale and satisfaction scores by over 20%.
2022-09-23,Critical,Survey Score,92,Finance,12,2023-03-18,In Progress,Revenue Growth,Jewel Agresta,admin,G000080,Increase annual sales revenue by 20% through strategic partnerships and expanding into new market segments.
2022-11-12,Low,Expense Ratio,83,HR,79,2023-06-30,In Progress,Customer Satisfaction,Vernon Engelman,admin,G000081,Develop a new customer feedback system to enhance our service responsiveness and improve overall satisfaction ratings by 20% within the next fiscal year.
2022-08-14,Critical,Expense Ratio,97,Finance,11,2022-10-07,In Progress,Cost Reduction,Travis Brockert,admin,G000082,Adopt new automation tools in the accounting department to cut operational expenses by 20% over the next fiscal year.
2022-11-14,Critical,Expense Ratio,95,IT,6,2023-01-11,In Progress,Cost Reduction,Doug Matrisciano,admin,G000083,Reduce operational expenses by optimizing energy usage across all company facilities targeting a 20% reduction over the next fiscal year.
2022-02-14,Low,Sales Increase,78,Marketing,28,2022-03-30,In Progress,Cost Reduction,Antony Thierauf,admin,G000084,"Reduce operational expenses by optimizing the energy consumption across all company facilities, targeting a 20% reduction by the end of the fiscal year."
2022-11-23,Medium,Survey Score,63,HR,47,2023-02-23,In Progress,Revenue Growth,User 1,admin,G000085,"Develop new partnerships and channels to increase sales revenue by 20% in the next fiscal year, targeting emerging markets in Asia and South America."
2022-01-31,Low,Employee Turnover Rate,74,Finance,90,2022-08-27,Completed,Customer Satisfaction,Timothy Janski,admin,G000086,Develop a new customer feedback system to increase satisfaction scores by 20% over the next 12 months.
2022-06-25,High,Expense Ratio,99,Finance,70,2022-11-25,In Progress,Revenue Growth,Mabel Weeden,admin,G000087,Increase enterprise-level subscription sales by 20% through targeted digital marketing campaigns and expanded regional sales teams.
2022-11-30,High,Survey Score,100,IT,68,2023-05-13,In Progress,Efficiency,Alfonso Griglen,admin,G000088,"Optimize IT support workflows to decrease average resolution time for tickets by 30%, enhancing overall operational efficiency."
2022-09-13,Medium,Sales Increase,92,HR,81,2023-06-14,In Progress,Efficiency,Vanessa Lewallen,admin,G000089,"Optimize IT support workflows to increase resolution speed by 30%, thereby reducing system downtime and improving user productivity."
2022-07-15,Medium,Expense Ratio,58,HR,22,2022-10-06,In Progress,Efficiency,Alejandra Prenatt,admin,G000090,"Enhance the document management system to reduce time spent on file retrieval by 30%, thereby increasing overall operational efficiency."
2022-02-09,High,Expense Ratio,64,Marketing,76,2022-08-14,Completed,Efficiency,Problem Administrator,admin,G000091,Enhance system response times by optimizing the database query logic to improve overall application efficiency by 20%.
2022-05-14,Low,Expense Ratio,64,Marketing,97,2022-10-21,Completed,Revenue Growth,Karen Flierl,admin,G000092,Increase annual revenue by 20% through the expansion of digital marketing efforts and partnerships.
2022-11-29,Critical,Sales Increase,70,Finance,95,2022-12-22,Completed,Cost Reduction,Thomas Jefferson,admin,G000093,"Reduce operational expenses by optimizing energy usage across all company facilities, aiming for a 20% cost reduction within the next fiscal year."
2022-11-01,High,Expense Ratio,87,Finance,26,2023-05-21,In Progress,Customer Satisfaction,Veronica Radman,admin,G000094,Enhance support team training to improve customer satisfaction scores by 20% in the upcoming quarter through better service and faster response times.
2022-04-27,Medium,Sales Increase,97,Finance,93,2022-10-30,Planned,Revenue Growth,Frankie Morein,admin,G000095,Expand into three additional international markets to increase overall revenue by 20% within the next fiscal year.
2022-11-07,High,Employee Turnover Rate,67,HR,10,2023-09-28,In Progress,Customer Satisfaction,Van Leanen,admin,G000096,Enhance user helpdesk experience by upgrading communication software to elevate customer satisfaction scores by 20% within the next quarter.
2022-09-17,High,Survey Score,98,Marketing,73,2022-09-27,In Progress,Cost Reduction,Vernon Engelman,admin,G000097,Optimize operational efficiencies to achieve a 20% reduction in overhead expenses by the end of Q4.
2022-01-03,Low,Survey Score,74,Marketing,37,2022-02-01,Planned,Cost Reduction,Jewel Agresta,admin,G000098,Reduce overall IT infrastructure costs by consolidating vendors and renegotiating contracts aiming for a 20% cost reduction by Q4.
2022-12-29,High,Expense Ratio,71,IT,33,2023-06-11,Planned,Customer Satisfaction,Christian Marnell,admin,G000099,Develop and deploy a new customer feedback system by Q3 to improve satisfaction scores by 20% based on survey results compared to the previous year.
2022-05-10,Medium,Sales Increase,78,IT,2,2023-02-09,In Progress,Employee Satisfaction,Frankie Morein,admin,G000100,Develop a quarterly employee engagement program aimed at improving job satisfaction scores by 20% through enhanced communication and recognition initiatives.
2022-02-18,Medium,Employee Turnover Rate,53,HR,63,2022-06-13,Completed,Employee Satisfaction,Misty Ericksen,admin,G000101,"Increase the employee satisfaction score from 70% to 85% by introducing flexible working hours, enhancing the workplace environment, and offering regular training and development sessions."
2022-09-10,Low,Employee Turnover Rate,93,IT,53,2023-08-07,In Progress,Customer Satisfaction,Jewel Agresta,admin,G000102,Develop a new customer feedback system to improve satisfaction scores by 20% over the next quarter.
