start_date,priority,metric,target_percentage,department,percent_complete,end_date,state,category,owner,sys_updated_by,sys_id,description
2022-12-13,Medium,Expense Ratio,82,Finance,51,2023-01-30,In Progress,Cost Reduction,Kathleen Beresnyak,admin,G000207,Optimize the use of IT resources to decrease overhead expenses by 20% within the next fiscal year.
2022-12-28,Medium,Sales Increase,81,Finance,27,2023-01-22,In Progress,Cost Reduction,Carmel Overfelt,admin,G000208,Optimize IT infrastructure by consolidating underutilized servers to achieve a 20% reduction in operational costs within 12 months.
2022-06-22,Low,Sales Increase,85,IT,77,2022-11-07,In Progress,Employee Satisfaction,Cristopher Wiget,admin,G000209,Launch a monthly feedback initiative to increase employee satisfaction scores by 20% over the next fiscal year.
2022-01-23,High,Survey Score,71,Finance,26,2022-08-03,In Progress,Revenue Growth,Mildred Gallegas,admin,G000210,"Develop and implement a new sales strategy aimed at increasing market share by 20% in the next financial year, targeting both existing and new customer segments."
2022-07-28,Low,Survey Score,84,Finance,69,2023-05-08,Planned,Customer Satisfaction,Carmel Overfelt,admin,G000211,"Increase the overall customer satisfaction score by improving response times and quality of support, aiming for a 20% uplift in customer survey results by the end of Q4."
2022-01-20,High,Sales Increase,91,Finance,9,2022-03-18,In Progress,Cost Reduction,Bridget Knightly,admin,G000212,"Reduce overall IT spending by optimizing software licensing agreements, aiming for a 20% cost savings over the next fiscal year."
2022-01-31,Critical,Sales Increase,88,Finance,58,2022-03-04,In Progress,Cost Reduction,Peggy Hohlstein,admin,G000213,Reduce overall IT infrastructure costs by consolidating vendor contracts and improving procurement efficiency to achieve a 20% reduction in spending across all departments.
2022-12-26,Low,Expense Ratio,88,IT,36,2023-01-18,Planned,Cost Reduction,Misty Ericksen,admin,G000214,"Reduce overhead costs in IT support by optimizing supplier contracts and renegotiating terms, aiming for a 20% reduction over the next fiscal year."
2022-08-01,High,Survey Score,92,HR,22,2023-02-21,In Progress,Customer Satisfaction,survey user,admin,G000215,"Develop a customer feedback system to enhance service quality, aiming to improve our customer satisfaction score by 20% over the next 12 months."
2022-11-26,Low,Sales Increase,58,HR,53,2023-04-27,Planned,Revenue Growth,Adela Cervantsz,admin,G000216,"Enhance digital marketing strategies to increase annual revenue by 20%, targeting new markets in Europe and Asia."
2022-03-01,High,Sales Increase,63,HR,89,2022-11-05,Completed,Customer Satisfaction,Rachel Larrison,admin,G000217,"Develop a new feedback system to enhance customer satisfaction ratings by 20% by the end of Q4, ensuring rapid resolution of customer issues and improved service quality."
2022-07-24,Low,Employee Turnover Rate,94,Finance,61,2022-12-23,In Progress,Efficiency,Carmel Overfelt,admin,G000218,"Optimize the internal workflow to decrease processing time by 20%, aiming to enhance overall operational efficiency."
2022-05-07,Critical,Employee Turnover Rate,52,Finance,3,2022-06-25,In Progress,Cost Reduction,Corinne Cowan,admin,G000219,"Reduce office supply expenses by optimizing vendor contracts and bulk purchasing, aiming for a 20% cost reduction within the next fiscal year."
2022-09-10,Critical,Sales Increase,78,Finance,56,2022-10-31,In Progress,Cost Reduction,Jacinto Gawron,admin,G000220,"Reduce overall IT spending by consolidating software licenses and renegotiating contracts, aiming to cut expenses by 20% over the next fiscal year."
2022-12-19,High,Employee Turnover Rate,66,Finance,101,2023-07-06,Completed,Employee Satisfaction,Karen Flierl,admin,G000221,Enhance the onboarding process to improve new employee satisfaction scores by 20% within the first 90 days of employment.
2022-05-12,Critical,Survey Score,97,Finance,37,2023-02-16,In Progress,Employee Satisfaction,Sandra Graen,admin,G000222,Enhance the onboarding experience to improve overall employee satisfaction ratings by 20% within the next fiscal year.
2022-01-30,Low,Sales Increase,69,IT,54,2022-04-17,Planned,Employee Satisfaction,Elmo Gabouer,admin,G000223,Increase employee satisfaction scores by 20% through the introduction of flexible working hours and remote working options.
2022-06-04,Medium,Employee Turnover Rate,61,Marketing,51,2022-12-12,In Progress,Customer Satisfaction,Lora Lendor,admin,G000224,Develop a new customer feedback system to improve satisfaction scores by 20% over the next 12 months through enhanced service responsiveness and personalized support.
2022-11-27,High,Employee Turnover Rate,63,Finance,8,2023-01-09,In Progress,Cost Reduction,Rich Gleave,admin,G000225,Reduce overall IT spending by 20% through strategic vendor negotiations and adopting more efficient cloud storage solutions.
2022-06-14,Medium,Sales Increase,57,Marketing,7,2022-12-29,In Progress,Revenue Growth,Stephen Seiters,admin,G000226,Increase annual sales by 20% through strategic partnerships and expanding into new geographic markets.
2022-03-07,Critical,Sales Increase,58,HR,36,2022-07-31,In Progress,Revenue Growth,Alfonso Griglen,admin,G000227,Develop a new customer engagement strategy to increase sales revenue by 20% within the next fiscal quarter.
2022-07-15,Critical,Survey Score,58,Finance,100,2022-08-21,Completed,Cost Reduction,Mara Vanderzwaag,admin,G000228,Reduce overall IT operational expenses by 10% in the next fiscal year through optimization of software licensing agreements and outsourcing non-essential services.
2022-10-05,High,Expense Ratio,79,IT,39,2023-03-12,Planned,Customer Satisfaction,Adela Cervantsz,admin,G000229,"Enhance the customer support interface to improve resolution times by 30%, aiming to increase overall customer satisfaction ratings by at least 20%."
2022-10-21,Critical,Employee Turnover Rate,75,IT,29,2023-01-29,In Progress,Revenue Growth,Geri Forness,admin,G000230,Expand market share by launching two new high-demand products which aim to increase quarterly revenues by 20%.
2022-07-02,Medium,Survey Score,100,Finance,36,2022-07-26,In Progress,Cost Reduction,Veronica Radman,admin,G000231,"Reduce IT overhead by optimizing server usage, leading to a 20% reduction in operational costs over the next fiscal year."
2022-04-20,High,Survey Score,86,Finance,73,2022-08-28,In Progress,Efficiency,Eva Seahorn,admin,G000232,"Optimize workflow automation to increase productivity by 20%, reducing average process completion times from 5 days to 4 days."
2022-09-18,Low,Survey Score,81,Marketing,34,2023-04-26,In Progress,Revenue Growth,Elmo Gabouer,admin,G000233,Achieve a 20% increase in annual revenue through strategic market expansions and improved online sales channels.
2022-06-18,Critical,Expense Ratio,89,HR,23,2022-12-01,In Progress,Customer Satisfaction,Travis Brockert,admin,G000234,Develop a new customer feedback system to increase satisfaction scores by 20% over the next 12 months.
2022-05-24,High,Expense Ratio,91,Finance,93,2022-06-04,Completed,Cost Reduction,Justina Dragaj,admin,G000235,"Reduce overall IT operational costs by optimizing server utilization and shutting down underused instances, aiming for a 20% cost saving over the next fiscal year."
2022-01-12,Critical,Sales Increase,89,Finance,40,2022-08-30,In Progress,Revenue Growth,Jacinto Gawron,admin,G000236,Expand into three new international markets to increase overall revenue by 20% over the next fiscal year.
2022-06-22,Low,Employee Turnover Rate,76,HR,71,2023-03-22,In Progress,Employee Satisfaction,Kennith Peto,admin,G000237,"Increase employee satisfaction scores by 20% through enhanced communication and engagement initiatives, regular feedback sessions, and improved work-life balance options."
2022-09-11,High,Expense Ratio,54,HR,59,2023-02-07,Completed,Efficiency,Rob Phillips,admin,G000238,"Optimize the IT support ticket system to reduce average resolution time by 20%, aiming for a boost in user satisfaction and operational efficiency."
2022-08-23,Critical,Sales Increase,68,Finance,26,2023-05-05,In Progress,Efficiency,survey user,admin,G000239,Optimize the IT support ticket system to reduce average resolution time by 20% over the next quarter.
2022-05-01,Medium,Survey Score,98,HR,0,2022-08-30,In Progress,Customer Satisfaction,Devon Teston,admin,G000240,"Enhance the customer support portal to increase self-service resolutions by 20%, thereby improving overall customer satisfaction ratings."
2022-11-28,Medium,Sales Increase,96,HR,17,2023-07-25,In Progress,Efficiency,survey user,admin,G000241,Increase the speed of IT ticket resolution by 30% through the adoption of automated response systems.
2022-04-13,Critical,Sales Increase,63,Finance,22,2022-10-02,In Progress,Employee Satisfaction,survey user,admin,G000242,Develop a comprehensive wellness program aimed at improving overall employee morale and reducing yearly attrition rates by 10%.
2022-09-12,Medium,Survey Score,62,IT,26,2023-02-25,In Progress,Efficiency,Rachel Larrison,admin,G000243,Increase the efficiency of IT support by reducing the ticket resolution time by 20% over the next quarter.
2022-08-21,High,Sales Increase,86,HR,37,2023-05-16,In Progress,Efficiency,Renae Eldrige,admin,G000244,"Enhance the IT support ticket system to reduce average resolution time by 20% by Q4, aiming for an average of 3 hours per ticket."
2022-08-10,Medium,Survey Score,83,Finance,14,2023-02-19,Cancelled,Customer Satisfaction,Vernon Engelman,admin,G000245,Enhance the support desk with new training programs to improve customer satisfaction ratings by at least 20% over the next quarter.
2022-04-01,High,Expense Ratio,91,Finance,11,2022-08-23,In Progress,Customer Satisfaction,Denice Nordlinger,admin,G000246,Increase the customer satisfaction score by 20% by improving response times and implementing weekly training sessions for customer service teams.
2022-10-16,Low,Sales Increase,83,Finance,69,2023-03-10,In Progress,Efficiency,Van Leanen,admin,G000247,"Develop automated task scheduling to improve workflow efficiency, aiming to reduce manual handling time by 30%."
2022-06-06,High,Employee Turnover Rate,68,IT,22,2022-10-14,Cancelled,Employee Satisfaction,Christa Bodenschatz,admin,G000248,Develop a quarterly employee engagement program to enhance workplace satisfaction and decrease employee turnover by 10% within the next fiscal year.
2022-02-26,Medium,Expense Ratio,62,Finance,74,2022-04-12,Completed,Cost Reduction,Marcelino Maggs,admin,G000249,Reduce operating expenses in the IT department by 20% through strategic vendor renegotiations and adopting more efficient cloud-based technologies.
2022-10-21,High,Survey Score,74,IT,18,2022-11-17,In Progress,Cost Reduction,Lora Lendor,admin,G000250,"Reduce overall IT infrastructure expenses by optimizing server usage, aiming to cut costs by 20% by the end of Q4."
2022-03-27,Critical,Employee Turnover Rate,71,HR,25,2022-07-03,In Progress,Customer Satisfaction,Password Admin,admin,G000251,Develop a new customer feedback system to achieve a 20% improvement in satisfaction rates by Q4.
2022-10-10,Critical,Employee Turnover Rate,75,Marketing,11,2022-10-27,In Progress,Cost Reduction,Denice Nordlinger,admin,G000252,Reduce IT operational expenses by 20% through optimizing software licensing and vendor consolidation over the next fiscal year.
2022-02-04,Medium,Expense Ratio,77,Finance,4,2022-08-19,In Progress,Efficiency,Karen Flierl,admin,G000253,"Optimize the use of in-house software tools to reduce process time by 20%, thereby improving overall workflow efficiency."
2022-12-19,Critical,Employee Turnover Rate,73,IT,83,2023-05-20,Completed,Efficiency,Manifah Masood,admin,G000254,"Optimize internal software usage to reduce average task completion time by 30%, enhancing overall operational efficiency."
2022-04-03,High,Sales Increase,87,Finance,40,2022-08-12,In Progress,Employee Satisfaction,Dwayne Maddalena,admin,G000255,"Increase employee satisfaction by launching a new wellness program that addresses mental health, physical fitness, and work-life balance, aiming for a 20% improvement in overall employee satisfaction survey scores."
2022-04-17,Low,Sales Increase,73,Finance,39,2022-05-02,Planned,Cost Reduction,Bridget Knightly,admin,G000256,"Develop automation of routine tasks to cut operational expenses by 20%, aiming to save approximately $50,000 annually."
2022-07-11,Low,Employee Turnover Rate,72,Finance,63,2023-04-03,In Progress,Employee Satisfaction,Mildred Gallegas,admin,G000257,Increase annual employee satisfaction survey score by 20% through improved workplace conditions and enhanced work-life balance initiatives.
2022-03-09,Low,Employee Turnover Rate,75,Marketing,89,2022-09-30,Completed,Revenue Growth,Geri Forness,admin,G000258,"Expand our customer base in the Asia-Pacific region by 20%, aiming to increase overall revenue by 30% within the next fiscal year."
2022-02-07,Medium,Employee Turnover Rate,95,HR,65,2022-09-25,In Progress,Customer Satisfaction,Lucius Bagnoli,admin,G000259,"Develop a new customer feedback system aimed at improving response rates by 30%, thus enhancing overall customer satisfaction scores by the end of the fiscal year."
2022-08-01,Low,Employee Turnover Rate,79,Finance,17,2022-09-04,In Progress,Cost Reduction,Maurine Monroy,admin,G000260,"Reduce operational expenses by optimizing energy usage across all corporate facilities, aiming for a 20% cost saving within the next fiscal year."
2022-10-27,High,Expense Ratio,62,Finance,61,2022-12-12,In Progress,Cost Reduction,Janet Schaffter,admin,G000261,"Reduce operational expenses by 20% through automation and renegotiating vendor contracts, aiming to save $120K annually."
2022-05-27,Medium,Expense Ratio,58,Finance,54,2022-06-26,In Progress,Cost Reduction,Frankie Morein,admin,G000262,Identify and eliminate non-essential service contracts to achieve a 20% reduction in operational expenses over the next fiscal year.
2022-08-16,Critical,Expense Ratio,80,IT,25,2023-04-28,In Progress,Employee Satisfaction,Nirali Patel,admin,G000263,"Develop and launch an employee feedback platform by Q3 to enhance engagement and satisfaction, aiming for a 20% improvement in employee satisfaction survey scores."
2022-03-12,Critical,Employee Turnover Rate,52,Finance,59,2022-10-02,Completed,Customer Satisfaction,Hilario Cassa,admin,G000264,Develop a new client feedback system aimed at increasing satisfaction scores by at least 20% over the next 12 months by enhancing response times and personalization of customer interactions.
2022-02-25,Critical,Employee Turnover Rate,90,Marketing,59,2022-06-21,In Progress,Efficiency,survey user,admin,G000265,Optimize internal software systems to increase workflow efficiency by 30% by the end of Q2.
2022-07-20,Critical,Sales Increase,98,Marketing,27,2023-06-13,In Progress,Employee Satisfaction,Allyson Gillispie,admin,G000266,Increase employee satisfaction scores by implementing a flexible work-from-home policy aiming to improve work-life balance. Target to achieve at least an 80% satisfaction rate in the next employee survey.
2022-12-11,Medium,Employee Turnover Rate,64,IT,39,2023-05-31,In Progress,Customer Satisfaction,Travis Brockert,admin,G000267,Enhance the customer support protocol to improve satisfaction ratings by 20% over the next quarter through increased training and adoption of advanced CRM tools.
2022-04-26,Critical,Sales Increase,66,IT,78,2022-05-26,Completed,Cost Reduction,Sandra Graen,admin,G000268,"Reduce software licensing expenses by consolidating vendors and renegotiating contracts, aiming for a 20% cost saving over the next fiscal year."
2022-02-27,High,Expense Ratio,98,Marketing,62,2022-08-18,In Progress,Revenue Growth,Gisela Kosicki,admin,G000269,Develop and launch new digital marketing campaigns to increase online sales by 20% over the next quarter.
2022-12-14,Medium,Expense Ratio,78,Finance,85,2023-07-28,Completed,Customer Satisfaction,Janet Schaffter,admin,G000270,Develop a new customer feedback system to improve overall satisfaction scores by 20% over the next 12 months.
2022-04-04,Low,Expense Ratio,92,Finance,3,2023-01-15,In Progress,Employee Satisfaction,Sandra Graen,admin,G000271,Develop a comprehensive training program aimed to increase employee skills and satisfaction scores by 20% over the next fiscal year.
2022-11-12,High,Employee Turnover Rate,92,Marketing,6,2023-07-22,In Progress,Efficiency,Cherie Fuhri,admin,G000272,"Enhance the employee onboarding process to reduce turnaround time by 30%, aiming for an average setup completion within the first week of hire."
2022-01-28,High,Survey Score,51,Finance,16,2022-02-17,In Progress,Cost Reduction,Rosalia Kennemur,admin,G000273,"Reduce operational expenses by optimizing energy usage across all facilities, targeting a 20% reduction in energy costs over the next fiscal year."
2022-07-17,Low,Employee Turnover Rate,53,Finance,18,2022-08-22,In Progress,Cost Reduction,Jimmie Barninger,admin,G000274,"Reduce overall IT support expenditure by consolidating vendor contracts, aiming for a minimum of 20% cost savings within the next fiscal year."
2022-07-03,Critical,Expense Ratio,93,Marketing,37,2022-11-27,In Progress,Revenue Growth,Kennith Peto,admin,G000275,Develop new strategic partnerships and expand distribution channels to increase quarterly revenue by 20%.
2022-02-14,Low,Survey Score,85,HR,48,2022-06-28,In Progress,Customer Satisfaction,Billie Cowley,admin,G000276,Enhance response times on customer service inquiries to improve satisfaction ratings by 20% over the next 12 months.
2022-01-25,High,Sales Increase,91,IT,95,2022-03-02,Completed,Efficiency,Terrell Rodda,admin,G000277,"Optimize IT system response times by upgrading server hardware, aiming for a 30% increase in processing speed."
2022-07-11,Critical,Employee Turnover Rate,82,Finance,71,2023-02-02,In Progress,Customer Satisfaction,Adela Cervantsz,admin,G000278,Develop a customer feedback system to improve satisfaction scores by at least 20% over the next fiscal year.
2022-08-14,Low,Employee Turnover Rate,75,Marketing,97,2023-01-20,Completed,Efficiency,Christa Bodenschatz,admin,G000279,"Optimize internal software deployment processes to shorten timelines by 30%, enhancing overall operational efficiency."
2022-08-22,Medium,Sales Increase,94,Marketing,51,2022-12-10,Cancelled,Efficiency,Janet Schaffter,admin,G000280,"Enhance the automation of report generation to decrease the time spent by staff by 30%, thereby improving overall operational efficiency."
2022-06-03,Medium,Expense Ratio,79,Finance,80,2022-07-03,Completed,Cost Reduction,Bridget Knightly,admin,G000281,"Reduce overall IT infrastructure expenses by optimizing cloud usage and renegotiating vendor contracts, aiming for a 20% cost reduction over the next fiscal year."
2022-03-21,Medium,Employee Turnover Rate,66,Marketing,22,2022-11-11,Planned,Revenue Growth,Lucas Santellana,admin,G000282,"Increase the annual revenue by expanding into three new international markets, aiming for a 20% growth compared to the previous fiscal year."
2022-11-20,Medium,Employee Turnover Rate,92,IT,74,2022-12-28,In Progress,Cost Reduction,Justina Dragaj,admin,G000283,"Reduce overall IT spending by optimizing software licenses, aiming for a 20% reduction in annual license costs from $500K to $400K."
2022-07-26,Medium,Employee Turnover Rate,97,Finance,34,2022-09-17,In Progress,Cost Reduction,Darren Merlin,admin,G000284,"Reduce overall IT spending by consolidating software licenses and renegotiating contracts, aiming for a 20% reduction in costs within the next fiscal year."
2022-08-09,High,Expense Ratio,87,HR,75,2023-03-05,In Progress,Employee Satisfaction,Allyson Gillispie,admin,G000285,Launch a quarterly feedback survey to improve employee satisfaction ratings by 20% over the next fiscal year.
2022-07-21,Low,Survey Score,93,Finance,4,2022-09-10,In Progress,Cost Reduction,Billie Cowley,admin,G000286,"Reduce overall IT infrastructure costs by optimizing cloud service subscriptions, aiming for a 20% reduction in expenditure by the end of the fiscal year."
2022-01-09,High,Sales Increase,53,Finance,67,2022-08-23,Completed,Revenue Growth,Geri Forness,admin,G000287,"Expand market share in the Asia-Pacific region by 20% through targeted marketing and local partnerships, aiming to increase annual revenues from $3M to $3.6M."
2022-12-23,Medium,Sales Increase,65,Marketing,60,2023-09-03,In Progress,Employee Satisfaction,Dwain Cuttitta,admin,G000288,Launch a quarterly employee survey to assess workplace satisfaction and develop action plans aimed at increasing the satisfaction score by 20% over the next fiscal year.
2022-12-06,Critical,Sales Increase,66,HR,92,2022-12-16,Completed,Cost Reduction,Christian Marnell,admin,G000289,"Reduce software licensing expenses by consolidating redundant applications and negotiating better rates, aiming to cut overall IT costs by 20% within the next fiscal year."
2022-07-14,Medium,Survey Score,86,HR,45,2023-01-26,In Progress,Employee Satisfaction,Savannah Kesich,admin,G000290,Develop a comprehensive training program to increase employee satisfaction scores by 20% in the next 12 months.
2022-09-06,Critical,Expense Ratio,59,IT,29,2022-12-05,In Progress,Customer Satisfaction,Carmel Overfelt,admin,G000291,"Enhance the online support portal to improve customer support response times by 20%, aiming to increase customer satisfaction ratings from 3.5 to 4.5 stars."
2022-11-18,Critical,Expense Ratio,70,Finance,71,2022-12-15,Completed,Cost Reduction,Corinne Cowan,admin,G000292,Reduce software licensing fees by consolidating unused licenses and negotiating bulk discount rates aiming for a 20% cost saving over the next fiscal year.
2022-08-12,Medium,Employee Turnover Rate,85,Finance,40,2022-09-26,In Progress,Cost Reduction,SOAP Guest,admin,G000293,"Reduce overall IT spending by optimizing software license management, aiming to decrease expenses by 20% over the next fiscal year."
2022-08-17,Critical,Expense Ratio,85,Finance,101,2022-09-11,Completed,Cost Reduction,Alyssa Biasotti,admin,G000294,"Optimize the workflow of the IT department to cut downtime expenses by 20%, leading to an annual saving of around $50,000."
2022-05-27,Medium,Sales Increase,81,HR,99,2022-10-15,Completed,Customer Satisfaction,Sean Bonnet,admin,G000295,Develop a new customer feedback system to increase satisfaction scores by 20% over the next 12 months.
2022-05-14,Low,Survey Score,94,Finance,76,2022-10-22,In Progress,Customer Satisfaction,Sophie Langner,admin,G000296,Enhance customer support training to improve satisfaction ratings by at least 20% in the next quarter through detailed feedback analysis and personalized customer interaction strategies.
2022-12-24,Medium,Expense Ratio,96,Marketing,45,2023-03-18,In Progress,Efficiency,Adela Cervantsz,admin,G000297,"Develop a new algorithm to optimize workflow management, aiming to improve overall task execution speed by 20%."
2022-03-21,Medium,Expense Ratio,57,Finance,55,2022-12-01,In Progress,Revenue Growth,Janet Schaffter,admin,G000298,Develop and launch two new product lines by Q4 to increase market share and boost overall revenue by 20%.
2022-02-14,Low,Employee Turnover Rate,86,IT,73,2022-03-14,In Progress,Cost Reduction,Derek Kreutzbender,admin,G000299,Reduce the overall IT expenditures by optimizing software licenses usage and eliminating redundant services to achieve a 20% cost savings within the next fiscal year.
2022-07-13,Medium,Employee Turnover Rate,77,Finance,88,2023-02-22,Completed,Customer Satisfaction,Derek Kreutzbender,admin,G000300,Develop and deploy an enhanced customer feedback system to improve satisfaction scores by 20% over the next fiscal year.
2022-10-31,Critical,Employee Turnover Rate,53,IT,26,2023-08-01,In Progress,Employee Satisfaction,Alyssa Biasotti,admin,G000301,Increase the annual employee satisfaction score by 20% through improved communication tools and feedback mechanisms.
2022-07-25,Critical,Employee Turnover Rate,73,Finance,60,2022-08-22,In Progress,Cost Reduction,Nelly Jakuboski,admin,G000302,"Reduce overhead expenses by optimizing our energy consumption across all offices, targeting a 20% cost saving in the next fiscal year."
2022-05-31,High,Employee Turnover Rate,86,Marketing,10,2022-12-30,In Progress,Customer Satisfaction,Renae Eldrige,admin,G000303,Develop a new customer feedback system to increase satisfaction ratings from 75% to 90% by the end of Q4.
2022-06-03,Critical,Sales Increase,55,Finance,69,2022-12-16,Completed,Employee Satisfaction,Cary Mccamey,admin,G000304,Initiate quarterly team-building events and improve office amenities to enhance overall employee satisfaction scores by 20%.
2022-09-23,Low,Expense Ratio,81,Finance,76,2023-03-10,In Progress,Employee Satisfaction,Password Admin,admin,G000305,Initiate a quarterly feedback program and enhance workplace amenities to boost employee satisfaction scores by 20% over the next fiscal year.
2022-06-17,Critical,Sales Increase,69,IT,38,2022-12-01,In Progress,Revenue Growth,Marcelino Maggs,admin,G000306,"Increase annual revenue by expanding into the Asian market, aiming for a 20% growth in sales within the first year of launch."
2022-08-29,Medium,Employee Turnover Rate,54,Finance,67,2022-10-02,Completed,Cost Reduction,Travis Brockert,admin,G000307,"Reduce overall IT spending by optimizing cloud service subscriptions, aiming for a 20% cost reduction within the next fiscal year."
2022-07-04,Medium,Expense Ratio,90,Marketing,9,2023-02-03,In Progress,Revenue Growth,Sean Bonnet,admin,G000308,"Develop new digital marketing strategies aimed at increasing customer acquisition by 20%, thereby boosting overall revenue growth in the next quarter."
