start_date,priority,metric,target_percentage,department,percent_complete,end_date,state,category,owner,sys_updated_by,sys_id,description
2022-03-29,Low,Employee Turnover Rate,71,Marketing,80,2022-08-10,Completed,Efficiency,Marcelino Maggs,admin,G000309,"Optimize the IT support ticket handling process to improve resolution time by 20%, aiming for an average handle time of less than 4 hours."
2022-06-11,Critical,Survey Score,57,Finance,84,2022-10-03,Completed,Revenue Growth,Rob Phillips,admin,G000310,Increase annual revenue by 20% through expansion into new markets and enhancing digital sales channels.
2022-04-30,Medium,Sales Increase,82,Marketing,33,2022-10-10,In Progress,Employee Satisfaction,Thomas Jefferson,admin,G000311,Develop and implement a quarterly team-building program to enhance employee satisfaction and reduce turnover rates by 20%.
2022-12-04,Low,Employee Turnover Rate,100,Marketing,2,2023-01-31,In Progress,Revenue Growth,Dwayne Maddalena,admin,G000312,Increase annual sales revenue by 20% through strategic partnerships and expanding into emerging markets.
2022-03-13,Low,Survey Score,61,Finance,87,2022-09-18,Completed,Revenue Growth,Veronica Radman,admin,G000313,Develop new regional markets for our product lines aiming to increase overall revenue by 20% over the next fiscal year.
2022-10-31,Critical,Survey Score,53,Finance,74,2023-04-14,Completed,Efficiency,Denice Nordlinger,admin,G000314,"Optimize IT support workflows to achieve a 20% reduction in ticket resolution time, aiming to improve customer satisfaction and operational efficiency."
2022-09-03,Critical,Survey Score,78,Marketing,34,2022-12-31,In Progress,Customer Satisfaction,Vanessa Lewallen,admin,G000315,Develop and launch a new customer feedback tool by Q3 to improve service ratings by at least 20% over the previous year.
2022-07-04,High,Expense Ratio,69,Finance,68,2023-01-06,In Progress,Efficiency,Kennith Peto,admin,G000316,Enhance software deployment processes to increase operational efficiency by 20%.
2022-08-30,Medium,Survey Score,60,Marketing,14,2022-09-20,In Progress,Cost Reduction,Van Leanen,admin,G000317,Reduce operational expenses by consolidating vendor contracts to achieve a 20% cost savings within the fiscal year.
2022-11-08,Low,Sales Increase,53,HR,18,2023-04-30,In Progress,Customer Satisfaction,Rob Phillips,admin,G000318,Enhance our customer support interface to improve response times and increase overall customer satisfaction ratings by 20% over the next quarter.
2022-07-16,High,Employee Turnover Rate,99,IT,68,2023-02-19,In Progress,Revenue Growth,Mildred Gallegas,admin,G000319,Expand market reach by launching targeted digital marketing campaigns to increase annual revenue by 20% over the previous fiscal year.
2022-01-18,Critical,Employee Turnover Rate,62,HR,55,2022-02-26,In Progress,Cost Reduction,Karen Flierl,admin,G000320,Develop automation strategies for routine tasks to decrease operational costs by 20% by the end of Q4.
2022-02-09,Low,Expense Ratio,64,IT,30,2022-03-22,In Progress,Cost Reduction,Sandra Graen,admin,G000321,Reduce office supply expenses by 20% over the next fiscal year by negotiating bulk purchase agreements and optimizing ordering cycles.
2022-11-25,Critical,Employee Turnover Rate,84,Finance,36,2022-12-21,Cancelled,Cost Reduction,Denice Nordlinger,admin,G000322,"Reduce overall IT expenditures by optimizing vendor contracts and consolidating software licenses, aiming for a 20% cost reduction within the next fiscal year."
2022-07-10,Low,Employee Turnover Rate,86,Finance,22,2023-01-08,In Progress,Employee Satisfaction,Misty Ericksen,admin,G000323,Develop and implement comprehensive employee wellness programs aimed to boost overall job satisfaction and reduce absenteeism by 20%.
2022-08-21,Critical,Employee Turnover Rate,59,HR,100,2023-04-12,Completed,Revenue Growth,Justina Dragaj,admin,G000324,Develop new digital marketing strategies to increase annual revenue by 20% through enhanced online customer engagement and targeted advertising.
2022-11-25,High,Sales Increase,93,Finance,38,2023-07-18,In Progress,Employee Satisfaction,Van Leanen,admin,G000325,Increase employee satisfaction scores by 20% through the implementation of a comprehensive wellness program and flexible work options.
2022-05-15,High,Expense Ratio,97,IT,5,2022-11-21,In Progress,Employee Satisfaction,Adela Cervantsz,admin,G000326,Develop and launch an employee wellness program aiming to enhance overall job satisfaction by 20% as measured by annual employee surveys.
2022-10-31,Critical,Survey Score,52,Marketing,85,2023-05-17,Completed,Employee Satisfaction,Dollie Pillitteri,admin,G000327,Develop and launch a quarterly feedback survey to enhance employee engagement and satisfaction levels across all departments.
2022-08-25,Medium,Sales Increase,100,Marketing,14,2022-12-08,In Progress,Customer Satisfaction,Savannah Kesich,admin,G000328,Develop a new client feedback system to increase customer satisfaction ratings by at least 20% over the next fiscal year.
2022-12-26,Low,Expense Ratio,93,HR,57,2023-01-06,In Progress,Cost Reduction,Justina Dragaj,admin,G000329,"Reduce overall software licensing expenses by consolidating vendors and eliminating underutilized services, aiming for a 20% cost saving over the next financial year."
2022-04-02,Low,Survey Score,54,Finance,50,2022-07-27,In Progress,Revenue Growth,Dollie Pillitteri,admin,G000330,Increase annual subscription sales by 20% through targeted marketing campaigns and new customer incentives.
2022-08-10,Low,Sales Increase,96,IT,36,2023-09-05,Planned,Customer Satisfaction,Terrell Rodda,admin,G000331,Enhance response times in customer service to achieve a 5-star rating in 90% of customer feedback surveys within the next quarter.
2022-02-18,Medium,Employee Turnover Rate,87,Finance,37,2022-03-07,In Progress,Cost Reduction,Cristopher Wiget,admin,G000332,"Reduce operational expenses by optimizing energy usage across all corporate facilities, aiming for a 20% reduction in monthly utility bills over the next fiscal year."
2022-08-28,High,Survey Score,79,Marketing,56,2023-04-10,In Progress,Employee Satisfaction,Jess Assad,admin,G000333,Initiate a quarterly employee feedback program aimed at identifying and addressing common concerns to improve overall job satisfaction rates by 20%.
2022-08-04,Medium,Employee Turnover Rate,85,HR,75,2022-10-30,In Progress,Efficiency,Christa Bodenschatz,admin,G000334,Optimize IT support workflow to reduce ticket resolution time by 20% within the next fiscal year.
2022-10-04,Critical,Survey Score,52,Marketing,14,2023-03-01,In Progress,Employee Satisfaction,Adela Cervantsz,admin,G000335,Launch a quarterly employee feedback survey to identify critical areas for improvement and boost overall employee satisfaction ratings by 20%.
2022-09-28,Medium,Employee Turnover Rate,95,HR,88,2023-03-25,In Progress,Efficiency,Maurine Monroy,admin,G000336,"Enhance the IT support ticketing system to improve response times by 20%, ensuring quicker resolution of technical issues for all departments."
2022-03-22,High,Sales Increase,88,Finance,101,2022-09-10,Completed,Efficiency,Christian Marnell,admin,G000337,Increase the automation of report generation tasks to enhance operational efficiency by reducing manual processing time by 30%.
2022-02-19,Medium,Survey Score,72,HR,39,2022-10-04,Cancelled,Revenue Growth,Justina Dragaj,admin,G000338,Increase annual subscription revenue by 25% through strategic marketing campaigns and expansion into new geographic markets.
2022-07-13,Critical,Sales Increase,74,IT,97,2022-10-12,Completed,Efficiency,Christa Bodenschatz,admin,G000339,"Optimize internal workflow to enhance process efficiency, aiming to reduce task completion time by 20% over the next quarter."
2022-05-28,Low,Survey Score,90,Finance,98,2022-06-17,Completed,Cost Reduction,Bryant Bouliouris,admin,G000340,Reduce IT operational expenditures by 20% by optimizing software licensing management and consolidating service vendors.
2022-01-15,High,Expense Ratio,56,Finance,72,2022-06-29,Completed,Employee Satisfaction,Kyle Lindauer,admin,G000341,Develop and launch a quarterly feedback survey to increase employee satisfaction scores by 20% over the next year through targeted improvements in work environment and team management practices.
2022-10-25,Critical,Expense Ratio,71,Marketing,34,2023-06-04,In Progress,Efficiency,Vernon Engelman,admin,G000342,"Enhance our project management software to improve task tracking efficiency, aiming to reduce the time spent on updates by 30%."
2022-03-20,Medium,Survey Score,82,Finance,31,2022-05-14,Planned,Cost Reduction,Devon Teston,admin,G000343,"Reduce operational expenditures by optimizing energy usage across all company facilities, aiming for a 20% reduction within the next fiscal year."
2022-03-19,Medium,Survey Score,61,Marketing,76,2022-04-16,Completed,Cost Reduction,Lora Lendor,admin,G000344,"Reduce operational expenses by consolidating tool subscriptions which could save up to 20% monthly, equating to approximately $10,000."
2022-06-16,Medium,Employee Turnover Rate,88,Marketing,4,2022-07-14,In Progress,Cost Reduction,Sophie Langner,admin,G000345,"Reduce operational expenses through the optimization of energy use in all corporate offices, aiming to lower energy costs by 20% over the next fiscal year."
2022-02-21,High,Employee Turnover Rate,94,IT,10,2022-07-24,In Progress,Employee Satisfaction,Vernon Engelman,admin,G000346,Develop and implement a new employee feedback system by Q3 to improve overall employee satisfaction scores by at least 20%.
2022-04-07,Medium,Expense Ratio,96,Marketing,5,2022-07-08,In Progress,Efficiency,Melinda Carleton,admin,G000347,"Enhance the server automation deployment to reduce manual intervention by 30%, thereby increasing overall IT operational efficiency."
2022-07-09,High,Sales Increase,82,HR,99,2023-03-25,Completed,Efficiency,Karyn Jinks,admin,G000348,"Enhance the internal reporting system to reduce the time needed for monthly closures by 30%, aiming for a process completion within 5 working days post month-end."
2022-03-20,Critical,Survey Score,55,Marketing,46,2022-04-20,Planned,Cost Reduction,Alfonso Griglen,admin,G000349,Reduce software licensing costs by consolidating enterprise agreements and negotiating volume discounts aiming for a 20% reduction by Q3.
2022-10-20,Low,Survey Score,69,IT,51,2023-05-03,Cancelled,Employee Satisfaction,Karen Flierl,admin,G000350,"Develop a comprehensive training program to enhance skill sets and job satisfaction among employees, aiming for a 20% increase in employee satisfaction survey scores by Q4."
2022-05-26,Critical,Sales Increase,70,HR,41,2022-10-08,In Progress,Employee Satisfaction,Carmel Overfelt,admin,G000351,Increase overall employee satisfaction scores by implementing monthly feedback sessions and enhancing workplace flexibility options.
2022-08-15,Low,Sales Increase,63,Finance,74,2023-01-31,Completed,Customer Satisfaction,Thomas Jefferson,admin,G000352,Enhance support systems to achieve a 20% increase in customer satisfaction ratings by implementing a new feedback loop and improving response times.
2022-12-29,Medium,Expense Ratio,84,HR,90,2023-01-24,Completed,Cost Reduction,Billie Cowley,admin,G000353,"Reduce operational expenses by optimizing energy usage across all facilities, aiming for a 20% reduction compared to previous fiscal year's figures."
2022-10-18,Critical,Expense Ratio,61,Finance,64,2022-10-29,Completed,Cost Reduction,Darren Merlin,admin,G000354,"Develop strategies to optimize energy usage across all facilities, aiming for a 20% reduction in utility costs by the end of the fiscal year."
2022-01-04,Low,Sales Increase,78,Finance,75,2022-02-26,In Progress,Cost Reduction,Savannah Kesich,admin,G000355,Reduce overall software licensing expenses by 20% through renegotiating vendor contracts and removing unused licenses.
2022-09-29,High,Survey Score,83,HR,88,2022-10-11,Completed,Cost Reduction,Security Center Data Collection User,admin,G000356,Reduce overhead expenses through improved vendor negotiation strategies aimed at lowering supply costs by up to 20% within the next fiscal year.
2022-06-24,High,Expense Ratio,73,Finance,40,2022-07-15,In Progress,Cost Reduction,Doug Matrisciano,admin,G000357,Reduce annual cloud hosting expenses by 20% by negotiating better rates with current providers and optimizing resource allocation across projects.
2022-11-12,Medium,Expense Ratio,81,IT,8,2023-05-04,In Progress,Employee Satisfaction,Sean Bonnet,admin,G000358,Launch a quarterly employee feedback survey to identify areas of improvement and increase overall employee satisfaction ratings by 30% over the next fiscal year.
2022-12-25,Critical,Survey Score,86,Finance,23,2023-02-19,In Progress,Cost Reduction,Elaine Renzi,admin,G000359,"Reduce operational expenditures by optimizing energy usage across all company facilities, aiming for a 20% cost saving in comparison to the previous fiscal year."
2022-08-20,High,Sales Increase,53,IT,66,2023-02-09,Completed,Customer Satisfaction,Terrell Rodda,admin,G000360,Increase customer satisfaction ratings by 20% through enhanced support services and quicker response times in the Q2 customer feedback survey.
2022-12-29,Low,Employee Turnover Rate,68,Marketing,72,2023-05-10,Completed,Revenue Growth,Henrietta Cintora,admin,G000361,Develop new digital marketing strategies aimed at increasing online sales by 20% over the next fiscal quarter.
2022-01-14,Medium,Employee Turnover Rate,99,IT,87,2022-03-01,In Progress,Cost Reduction,Christian Marnell,admin,G000362,"Reduce operational expenses by optimizing energy usage across all corporate facilities, aiming for at least a 20% reduction in monthly utility bills by the end of the fiscal year."
2022-11-08,Low,Survey Score,100,HR,45,2023-01-01,In Progress,Cost Reduction,Jess Assad,admin,G000363,"Reduce operational expenses by optimizing energy usage across all corporate branches, aiming for a 20% reduction in energy costs over the next fiscal year."
2022-06-12,Medium,Expense Ratio,88,IT,3,2022-07-19,In Progress,Cost Reduction,User 1,admin,G000364,Achieve a 10% reduction in operating costs by optimizing energy usage across all company facilities within the next fiscal year.
2022-08-29,Low,Sales Increase,57,Marketing,4,2022-10-28,Cancelled,Cost Reduction,Logan Muhl,admin,G000365,Reduce overall software licensing costs by optimizing subscriptions and eliminating redundant applications to achieve a 20% cost reduction compared to the previous fiscal year.
2022-04-24,Medium,Sales Increase,54,Finance,10,2022-06-05,In Progress,Cost Reduction,Dollie Pillitteri,admin,G000366,Optimize energy consumption in all operational facilities to achieve a 20% reduction in total energy expenses within the next fiscal year.
2022-11-25,Low,Employee Turnover Rate,86,Finance,66,2023-04-03,In Progress,Employee Satisfaction,Christian Marnell,admin,G000367,Launch a quarterly feedback survey initiative to improve employee satisfaction scores by 20% over the next fiscal year.
2022-06-20,Low,Survey Score,51,IT,100,2023-01-25,Completed,Employee Satisfaction,SOAP Guest,admin,G000368,"Launch a quarterly feedback survey to assess employee satisfaction, aiming to improve the overall score by 20% before the end of the fiscal year."
2022-07-22,Low,Survey Score,92,Marketing,19,2023-01-21,In Progress,Efficiency,Lora Lendor,admin,G000369,"Optimize IT support workflows to reduce average ticket resolution time by 30%, aiming to boost overall operational efficiency."
2022-10-06,Medium,Survey Score,74,IT,29,2023-06-11,In Progress,Customer Satisfaction,User 1,admin,G000370,Enhance the response time of our customer service team to improve the customer satisfaction score by 20% by the end of Q4.
2022-01-18,High,Employee Turnover Rate,54,HR,41,2022-07-21,In Progress,Customer Satisfaction,Mabel Weeden,admin,G000371,Develop a new customer feedback system to increase satisfaction scores by 20% over the next six months.
2022-02-16,Medium,Sales Increase,56,Finance,71,2022-03-08,Completed,Cost Reduction,Joey Sedore,admin,G000372,Optimize supplier contracts to achieve a 20% reduction in operational expenses over the next fiscal year.
2022-02-15,High,Sales Increase,54,Marketing,8,2022-08-12,In Progress,Customer Satisfaction,Jimmie Barninger,admin,G000373,Enhance the customer support interface to improve user satisfaction ratings by at least 20% over the next quarter.
2022-08-11,Low,Employee Turnover Rate,74,Finance,41,2022-08-25,In Progress,Cost Reduction,Kennith Peto,admin,G000374,"Achieve a 20% reduction in office consumables expenses by negotiating bulk purchase agreements with suppliers, aiming to decrease from $50K to $40K annually."
2022-08-04,Critical,Employee Turnover Rate,71,IT,26,2023-05-31,In Progress,Employee Satisfaction,Peggy Hohlstein,admin,G000375,"Launch an annual employee satisfaction survey to identify improvement areas, aiming to increase overall satisfaction scores by 20% over the next fiscal year."
2022-04-12,High,Expense Ratio,97,Marketing,22,2022-05-25,Planned,Cost Reduction,Cherie Fuhri,admin,G000376,"Reduce operational expenses by optimizing energy use across all company facilities, aiming for a 20% reduction in monthly utilities costs."
2022-06-02,Medium,Sales Increase,65,Finance,35,2022-07-06,In Progress,Cost Reduction,SOAP Guest,admin,G000377,"Reduce annual operating costs by optimizing supplier contracts and internal spending, aiming for a reduction target of 20% year-over-year."
2022-10-30,Low,Expense Ratio,100,Finance,55,2023-08-31,In Progress,Customer Satisfaction,Allyson Gillispie,admin,G000378,Develop and implement a new customer feedback system to increase overall satisfaction ratings by 20% within the next fiscal year.
2022-11-13,High,Expense Ratio,52,HR,67,2023-05-29,Completed,Revenue Growth,Suresh Yekollu,admin,G000379,Develop and launch a new software product line aimed at small businesses to increase annual revenue by 20%.
2022-01-05,Low,Survey Score,51,IT,60,2022-03-01,Completed,Efficiency,Cary Mccamey,admin,G000380,"Optimize IT system response times by upgrading hardware, aiming to improve processing speed by 30% within the next quarter."
2022-05-10,High,Survey Score,58,Finance,36,2022-06-05,Cancelled,Cost Reduction,Geri Forness,admin,G000381,"Reduce overall IT infrastructure expenses by optimizing server usage, targeting a 20% cost savings over the next fiscal year."
2022-08-13,Medium,Survey Score,83,Finance,16,2023-05-23,In Progress,Customer Satisfaction,Sandra Graen,admin,G000382,"Develop comprehensive training for customer service representatives to enhance interaction quality, aiming to improve customer satisfaction scores by at least 20% by the end of the fiscal year."
2022-04-29,Low,Sales Increase,56,Finance,33,2022-10-29,In Progress,Customer Satisfaction,Naomi Greenly,admin,G000383,Develop a new customer feedback system to increase satisfaction scores by 20% over the next 12 months.
2022-10-22,Low,Sales Increase,71,Finance,94,2022-11-30,Completed,Cost Reduction,Rob Phillips,admin,G000384,Reduce software licensing costs by consolidating unused licenses and renegotiating terms to achieve a 20% cost reduction within the next fiscal year.
2022-01-09,Low,Sales Increase,93,HR,67,2022-09-30,Planned,Employee Satisfaction,Jewel Agresta,admin,G000385,Develop and implement a quarterly team-building program aimed at boosting employee morale and satisfaction by 20% as measured by annual surveys.
2022-05-09,Low,Expense Ratio,78,HR,80,2022-10-20,Completed,Efficiency,Jimmie Barninger,admin,G000386,"Enhance software deployment automation to decrease average setup time by 30%, aiming to increase overall team productivity."
2022-01-03,Low,Expense Ratio,81,IT,49,2022-06-06,In Progress,Customer Satisfaction,Melinda Carleton,admin,G000387,Increase customer satisfaction rating from 82% to 90% by improving response times and training support staff on customer engagement techniques.
2022-05-28,Critical,Sales Increase,70,Finance,85,2022-06-14,Completed,Cost Reduction,Marcelino Maggs,admin,G000388,"Reduce IT infrastructure expenses by consolidating vendor contracts and optimizing license management, aiming for a 20% cut in the overall budget by the end of the fiscal year."
2022-12-02,Critical,Employee Turnover Rate,67,Finance,26,2022-12-12,In Progress,Cost Reduction,Krystle Stika,admin,G000389,"Reduce operational expenses by optimizing energy consumption across all corporate offices, targeting a 20% reduction by the end of Q4 compared to the previous fiscal year."
2022-10-22,Medium,Sales Increase,84,IT,29,2023-05-28,In Progress,Customer Satisfaction,Valerie Pou,admin,G000390,Enhance the customer support portal to improve satisfaction ratings by at least 20% over the next fiscal year.
2022-09-20,Low,Expense Ratio,92,HR,48,2023-08-09,In Progress,Employee Satisfaction,Mabel Weeden,admin,G000391,"Launch an annual Employee Satisfaction Survey to identify key areas of improvement, aiming to enhance job satisfaction rates by at least 20% over the next fiscal year."
2022-05-22,Low,Employee Turnover Rate,84,IT,40,2022-06-20,In Progress,Cost Reduction,Doug Matrisciano,admin,G000392,"Reduce software licensing costs by optimizing the number of enterprise licenses based on actual usage, aiming for a 20% cost reduction within the next fiscal year."
2022-03-26,Medium,Sales Increase,95,Finance,79,2022-04-25,In Progress,Cost Reduction,Carmel Overfelt,admin,G000393,"Reduce the number of software subscriptions by identifying underutilized licenses, aiming for a 20% cost savings in IT expenditures over the next fiscal year."
2022-03-26,Medium,Employee Turnover Rate,83,Marketing,11,2022-04-29,In Progress,Cost Reduction,Marcelino Maggs,admin,G000394,"Reduce operational expenses by optimizing energy usage in all facilities, aiming for a 20% reduction over the next two years."
2022-03-24,Critical,Employee Turnover Rate,83,Marketing,27,2022-08-13,In Progress,Efficiency,User 1,admin,G000395,"Optimize IT support workflows to reduce ticket resolution time by 30%, aiming to enhance overall user satisfaction and productivity."
2022-04-30,High,Employee Turnover Rate,70,Marketing,67,2022-09-19,In Progress,Customer Satisfaction,Frankie Morein,admin,G000396,Improve our response times on customer service requests by 30% to boost customer satisfaction ratings.
2022-06-19,Low,Survey Score,97,IT,52,2023-03-31,In Progress,Efficiency,Miquel Demicco,admin,G000397,"Enhance the current helpdesk system to improve the average ticket response time by 30%, aiming to increase overall operational efficiency."
2022-01-09,Low,Sales Increase,72,Finance,39,2022-05-04,In Progress,Customer Satisfaction,Jess Assad,admin,G000398,Develop a comprehensive training program for customer service representatives to improve customer satisfaction scores by 20% over the next fiscal year.
2022-09-04,Medium,Expense Ratio,81,Marketing,58,2022-12-13,In Progress,Revenue Growth,Pierre Salera,admin,G000399,Develop and launch a new cloud-based platform to increase annual subscription revenue by 20% over the next 12 months.
2022-10-10,High,Sales Increase,85,HR,81,2023-05-20,In Progress,Efficiency,Henrietta Cintora,admin,G000400,Optimize IT support workflows to reduce average ticket resolution time by 30% over the next quarter.
2022-10-01,High,Sales Increase,57,Marketing,89,2022-11-18,Completed,Cost Reduction,Travis Brockert,admin,G000401,"Optimize IT support resource allocation to decrease overhead expenses by 20%, aiming a reduction from $500K to $400K annually."
2022-03-12,Medium,Employee Turnover Rate,56,Finance,93,2022-06-17,Completed,Employee Satisfaction,Sean Bonnet,admin,G000402,Develop and implement a quarterly team-building program aimed at improving work environment and boosting overall employee satisfaction scores by 20%.
2022-11-30,Low,Expense Ratio,57,HR,98,2023-05-31,Completed,Employee Satisfaction,Adela Cervantsz,admin,G000403,Initiate a quarterly feedback survey to assess employee satisfaction and implement necessary changes to increase the satisfaction score by 20% by the end of the year.
2022-03-28,Low,Survey Score,58,Finance,24,2022-10-07,In Progress,Revenue Growth,Nirali Patel,admin,G000404,Increase annual software subscription revenues by 20% through enhanced marketing strategies and new customer incentive programs.
2022-05-19,Critical,Employee Turnover Rate,93,HR,71,2023-02-04,In Progress,Customer Satisfaction,Rich Gleave,admin,G000405,Enhance the online user interface to improve customer satisfaction ratings by at least 20% within the next fiscal year.
2022-08-01,Low,Expense Ratio,63,IT,83,2023-06-12,Completed,Employee Satisfaction,Tammie Schwartzwalde,admin,G000406,Develop a comprehensive employee wellness program aimed at improving overall job satisfaction and reducing turnover rates by 20%.
2022-01-21,Low,Survey Score,76,HR,38,2022-08-10,Cancelled,Efficiency,Sandra Graen,admin,G000407,Develop automation for routine data entry tasks to enhance process efficiency and reduce manual effort by 30% within the next quarter.
2022-05-18,Critical,Sales Increase,51,HR,36,2022-11-25,In Progress,Customer Satisfaction,Alyssa Biasotti,admin,G000408,Enhance the customer support portal to improve user experience and aim for a 25% increase in customer satisfaction ratings as measured by quarterly surveys.
2022-10-21,High,Sales Increase,59,Finance,2,2023-05-11,In Progress,Efficiency,Nelly Jakuboski,admin,G000409,"Optimize IT support workflows to reduce ticket resolution times by 20%, aiming to enhance overall team productivity and customer satisfaction."
2022-08-26,Medium,Sales Increase,96,Finance,44,2022-12-04,In Progress,Revenue Growth,Lucas Santellana,admin,G000410,"Increase annual software service subscriptions by 20%, aiming to boost revenue from $500K to $600K through enhanced marketing strategies and customer engagement."
