source_id,department,number,amount,category,state,processed_date,type,user,opened_at,short_description,ci
,Product Management,EXP00000448,8000,Travel,Processed,2023-02-21 10:57:23.680876209,,Mamie Mcintee,2023-02-12 09:57:00,Travel related asset,Corporate Travel Equipment
,Product Management,EXP00000449,8000,Travel,Submitted,,,Mamie Mcintee,2024-04-06 20:13:00,Travel equipment asset generated,Business-Class Travel Laptop
,Product Management,EXP00000450,8000,Travel,Processed,2024-02-20 09:47:37.760148580,,Mamie Mcintee,2024-02-19 04:39:00,Travel related hardware for employees,Portable Charger Pack
,Product Management,EXP00000451,8000,Travel,Declined,,,Mamie Mcintee,2023-09-20 02:02:00,Travel-related asset creation,Travel Booking Software 
,Product Management,EXP00000452,8000,Travel,Processed,2023-05-26 23:35:43.538038508,,Mamie Mcintee,2023-05-23 03:23:00,Configuration item for travel,Business Travel Package
,Product Management,EXP00000453,8000,Travel,Pending,,,Mamie Mcintee,2024-04-11 10:15:00,Travel related hardware asset created,Lenovo Thinkpad Travel Edition
,Product Management,EXP00000454,8000,Travel,Processed,2024-03-15 16:18:11.202881363,,Mamie Mcintee,2024-02-25 05:12:00,Travel-related asset allocation,Travelers Laptop Dell Latitude
,Product Management,EXP00000455,8000,Travel,Processed,2024-02-28 08:58:09.134306854,,Mamie Mcintee,2024-02-21 12:23:00,Automatically generated expense line for creation of travel asset,Business Class Flight Ticket
,Product Management,EXP00000456,8000,Travel,Processed,2023-12-08 16:54:12.952389578,,Mamie Mcintee,2023-12-07 11:12:00,Travel related asset generated,VIP Executive Travel Kit
,Product Management,EXP00000457,8000,Travel,Processed,2024-01-09 09:26:10.702068779,,Mamie Mcintee,2024-01-07 08:04:00,Travel based configuration asset item,GPS Navigator Model X
,Product Management,EXP00000458,8000,Travel,Submitted,,,Mamie Mcintee,2023-06-04 01:40:00,Automatically generated expense line for creation of travel asset,First-class Airliner Ticket
,Product Management,EXP00000459,8000,Travel,Processed,2024-02-07 08:40:19.736792856,,Mamie Mcintee,2024-01-26 19:02:00,Automatically generated expense line for travel-related asset,Travel Backpack
,Product Management,EXP00000460,8000,Travel,Processed,2023-10-19 18:47:00.000000000,,Mamie Mcintee,2023-10-18 18:47:00,Travel equipment asset registration,Portable Global Positioning System
,Product Management,EXP00000461,8000,Travel,Processed,2023-12-04 18:47:28.550828341,,Mamie Mcintee,2023-12-02 03:45:00,Travel related hardware asset creation,Travel Accessory Kit
,Product Management,EXP00000462,8000,Travel,Processed,2024-01-07 00:14:03.902456586,,Mamie Mcintee,2023-12-24 08:19:00,Automatically generated expense line for creation of Travel Equipment,Samsonite Pro-DLX 4 Suitcase
,Product Management,EXP00000463,8000,Travel,Declined,,,Mamie Mcintee,2023-05-05 19:52:00,Travel related equipment asset,Targus CityLite Laptop Bag
,Product Management,EXP00000464,8000,Travel,Processed,2023-02-06 08:43:18.187290016,,Mamie Mcintee,2023-02-01 04:13:00,Travel expense creation for new asset,Travel Equipment
,Product Management,EXP00000465,8000,Travel,Processed,2024-03-01 20:02:14.249017439,,Mamie Mcintee,2024-02-17 01:03:00,Travel related expense line for acquisition of GPS tracker,Garmin GPS Tracker G5
,Product Management,EXP00000466,8000,Travel,Processed,2023-10-04 14:35:06.516842373,,Mamie Mcintee,2023-09-26 15:44:00,Travel equipment asset registration,Travel suitcase
,Product Management,EXP00000467,8000,Travel,Declined,,,Mamie Mcintee,2023-07-09 17:30:00,Automatically generated expense line for creation of travel asset,Flight Ticket
,Product Management,EXP00000468,8000,Travel,Declined,,,Mamie Mcintee,2023-09-05 12:58:00,Travel baggage tracking device,GPS Tracker Model X
,Product Management,EXP00000469,8000,Travel,Processed,2023-10-04 20:16:34.829898636,,Mamie Mcintee,2023-09-23 20:07:00,Travel department hardware asset registration,Lenovo ThinkPad X1 Carbon
,Product Management,EXP00000470,8000,Travel,Processed,2023-03-08 10:27:36.810234818,,Mamie Mcintee,2023-03-01 08:40:00,Travel equipment acquisition expense,High-end travel laptop
,Product Management,EXP00000471,8000,Travel,Processed,2024-04-21 00:15:58.287020149,,Mamie Mcintee,2024-04-12 06:45:00,Travel related asset addition,Car Rental Service
,Product Management,EXP00000472,8000,Travel,Declined,,,Mamie Mcintee,2023-08-11 08:42:00,Travel item asset addition,Extra durable travelling backpack
,Product Management,EXP00000473,8000,Travel,Processed,2023-04-04 10:57:00.000000000,,Mamie Mcintee,2023-04-03 10:57:00,Travel expense incurred for new asset acquisition,Airline Ticket
,Product Management,EXP00000474,8000,Travel,Processed,2023-03-15 14:55:46.689133346,,Mamie Mcintee,2023-03-12 13:07:00,Travel related asset creation,Travel Expense Voucher
,Product Management,EXP00000475,8000,Travel,Pending,,,Mamie Mcintee,2023-08-10 02:54:00,Travel related automated expenditure for asset acquisition,Travel Equipment Kit 20
,Product Management,EXP00000476,8000,Travel,Processed,2023-12-09 15:43:52.396312911,,Mamie Mcintee,2023-11-29 05:30:00,Travel related asset purchasing,International Travel Package
,Product Management,EXP00000477,8000,Travel,Processed,2023-11-10 23:56:27.167626239,,Mamie Mcintee,2023-11-07 10:29:00,Travel equipment asset creation,Traveler's Laptop Dell XPS 13
,Product Management,EXP00000478,8000,Travel,Pending,,,Mamie Mcintee,2023-08-08 14:41:00,Hardware asset for business travel,Dell Latitude 7400 14
,Product Management,EXP00000479,8000,Travel,Declined,,,Mamie Mcintee,2023-11-15 07:15:00,Travel-related hardware asset,Travel Pro Bag
,Product Management,EXP00000480,8000,Travel,Processed,2023-09-29 11:20:35.068235070,,Mamie Mcintee,2023-09-10 17:33:00,Travel asset management: suitcase,Samsonite Omni PC 20
,Product Management,EXP00000481,8000,Travel,Processed,2023-09-15 22:53:00.000000000,,Mamie Mcintee,2023-09-14 22:53:00,Travel-related hardware asset,Portable Power Bank
,Product Management,EXP00000482,8000,Travel,Processed,2023-09-08 02:02:00.000000000,,Mamie Mcintee,2023-09-07 02:02:00,Travel assets management,Luggage Trolley
,Product Management,EXP00000483,8000,Travel,Processed,2023-04-26 00:17:05.490471601,,Mamie Mcintee,2023-04-22 12:33:00,Business travel related hardware asset,Dell Latitude 7210
,Product Management,EXP00000484,8000,Travel,Processed,2023-05-31 16:15:51.516764034,,Mamie Mcintee,2023-05-08 07:23:00,Travel expense record for purchase of asset,Travel Luggage
,Product Management,EXP00000485,8000,Travel,Processed,2023-10-31 09:11:44.762394754,,Mamie Mcintee,2023-10-23 07:54:00,Travel related expense for allocation of asset,Travel Kit Essentials
,Product Management,EXP00000486,8000,Travel,Processed,2023-06-09 18:56:00.000000000,,Mamie Mcintee,2023-06-08 18:56:00,Travel Expense Tracker Software Asset,HP EliteBook 840 G7
,Product Management,EXP00000487,8000,Travel,Processed,2024-02-20 22:45:00.000000000,,Mamie Mcintee,2024-02-19 22:45:00,Automatically generated expense line for creation of travel equipment,Business Travel Suitcase
,Product Management,EXP00000488,8000,Travel,Processed,2023-06-02 10:03:00.000000000,,Mamie Mcintee,2023-06-01 10:03:00,Travel equipment asset,Dell Latitude 7400
,Product Management,EXP00000489,8000,Travel,Processed,2023-02-18 15:16:02.115836912,,Mamie Mcintee,2023-02-16 09:43:00,Travel equipment asset registration,Luggage Tracker Device
,Product Management,EXP00000490,8000,Travel,Processed,2023-02-13 19:33:04.387205999,,Mamie Mcintee,2023-02-09 03:07:00,Travel related asset ingestion,Travel Accommodation Booking System
,Product Management,EXP00000491,8000,Travel,Pending,,,Mamie Mcintee,2023-04-05 02:26:00,Automatically generated expense line for creation of travel asset,Luxury Bus 40-seater
,Product Management,EXP00000492,8000,Travel,Processed,2023-11-24 03:53:45.197875004,,Mamie Mcintee,2023-11-21 13:41:00,Travel equipment asset - Portable Global Navigation Satellite System,Travel Garmin GPS
,Product Management,EXP00000493,8000,Travel,Processed,2023-03-29 06:43:05.133215451,,Mamie Mcintee,2023-03-25 17:09:00,Travel-related hardware asset,Portable Travel Router
,Product Management,EXP00000494,8000,Travel,Declined,,,Mamie Mcintee,2023-07-30 09:42:00,Airline ticket booking system,Travel Management Asset
,Product Management,EXP00000495,8000,Travel,Pending,,,Mamie Mcintee,2023-11-27 15:13:00,Travel equipment asset creation,Travel suitcase Pro 18
,Product Management,EXP00000496,8000,Travel,Processed,2023-02-18 19:49:40.390957653,,Mamie Mcintee,2023-02-07 20:20:00,Automatically generated expense line for creation of Travel asset,Travel Equipment Luggage Trolley
,Product Management,EXP00000497,8000,Travel,Processed,2023-06-26 10:51:54.315298415,,Mamie Mcintee,2023-06-08 21:30:00,Automatically generated expense line for purchase of travel equipment,Standard Luggage Suitcase
,Product Management,EXP00000498,8000,Travel,Processed,2023-10-21 02:09:06.444458676,,Mamie Mcintee,2023-10-12 16:47:00,Automatically generated expense line for creation of travel asset,Standard Carry-On Luggage
,Product Management,EXP00000499,8000,Travel,Declined,,,Mamie Mcintee,2024-01-21 23:22:00,Travel equipment asset creation,TomTom GPS Navigator
