start_date,priority,metric,target_percentage,department,percent_complete,end_date,state,category,owner,sys_updated_by,sys_id,description
2022-12-07,Medium,Expense Ratio,79,Finance,33,2023-05-04,In Progress,Efficiency,Jess Assad,admin,G000103,"Optimize workflow automation to increase document processing speed by 30%, aiming to minimize manual data entry and enhance operational efficiency."
2022-11-26,Low,Employee Turnover Rate,98,Finance,100,2023-01-22,Completed,Cost Reduction,Rosalia Kennemur,admin,G000104,Reduce operational spending by consolidating vendor contracts and achieving a 20% reduction in office supply expenses within the next fiscal year.
2022-03-21,High,Sales Increase,73,IT,81,2022-10-12,Completed,Revenue Growth,Frankie Morein,admin,G000105,Increase software product sales by 20% over the next fiscal year through enhanced online marketing strategies and partnership expansions.
2022-02-03,Medium,Sales Increase,74,Finance,9,2022-05-30,Planned,Efficiency,Antony Thierauf,admin,G000106,Optimize IT support workflows to achieve a 20% increase in ticket resolution efficiency within the next quarter.
2022-02-12,Critical,Sales Increase,91,Finance,0,2022-03-19,In Progress,Cost Reduction,Derek Kreutzbender,admin,G000107,Reduce overall IT operational expenses by 20% by optimizing cloud usage and renegotiating vendor contracts.
2022-01-21,Critical,Survey Score,98,IT,99,2022-10-05,Completed,Revenue Growth,Ross Spurger,admin,G000108,Develop new regional markets for our flagship product to increase annual revenue by 20%.
2022-09-04,Low,Survey Score,51,Finance,98,2023-04-13,Completed,Efficiency,Cherie Fuhri,admin,G000109,"Optimize internal review processes to shorten project delivery times by 20%, aiming to increase overall operational efficiency."
2022-06-15,Medium,Sales Increase,94,Marketing,51,2022-09-06,Cancelled,Customer Satisfaction,Marcelino Maggs,admin,G000110,Develop an enhanced customer support protocol to improve customer satisfaction ratings by 20% through quicker response times and personalized service follow-ups.
2022-03-22,Critical,Employee Turnover Rate,89,IT,62,2022-04-01,In Progress,Cost Reduction,Password Admin,admin,G000111,Reduce overall IT infrastructure costs by optimizing server utilization and reducing redundant cloud storage by 20% within the next fiscal year.
2022-03-22,Low,Employee Turnover Rate,60,HR,99,2022-04-17,Completed,Cost Reduction,Darren Merlin,admin,G000112,"Reduce overall IT infrastructure costs by optimizing cloud storage usage and improving vendor contracts, aiming for a 20% cost reduction within the next fiscal year."
2022-02-26,Critical,Sales Increase,76,Finance,70,2022-03-10,Planned,Cost Reduction,Rosalia Kennemur,admin,G000113,Achieve a 20% reduction in operational expenses by optimizing supplier contracts and reducing energy consumption by the end of the fiscal year.
2022-04-27,Low,Sales Increase,54,Finance,100,2022-11-30,Completed,Efficiency,Lucius Bagnoli,admin,G000114,"Enhance the software deployment workflow to decrease setup times by 30%, aiming to improve overall team productivity and project timelines."
2022-06-10,Low,Employee Turnover Rate,97,Finance,87,2022-06-26,In Progress,Cost Reduction,Christa Bodenschatz,admin,G000115,"Reduce operational expenses by 10% through automation and renegotiating vendor contracts, aiming to save $50K annually."
2022-10-11,High,Employee Turnover Rate,71,Finance,101,2022-10-25,Completed,Cost Reduction,Peggy Hohlstein,admin,G000116,"Reduce operational expenses by optimizing inventory management, aiming for a 20% cost savings within the next fiscal year."
2022-04-05,Low,Survey Score,93,HR,99,2023-01-13,Completed,Revenue Growth,Dollie Pillitteri,admin,G000117,Increase annual software subscription sales by 20% through expanded marketing outreach and enhanced customer engagement strategies.
2022-12-09,Critical,Sales Increase,54,IT,81,2023-03-16,Completed,Efficiency,Allyson Gillispie,admin,G000118,"Optimize IT support workflows to increase response time by 30%, effectively reducing average ticket resolution from 3 hours to 2 hours."
2022-07-06,High,Employee Turnover Rate,94,Finance,18,2022-08-11,In Progress,Cost Reduction,Mabel Weeden,admin,G000119,Achieve a 20% reduction in operational expenditures by optimizing IT infrastructure and automating routine tasks.
2022-07-23,Medium,Employee Turnover Rate,83,Marketing,19,2022-10-12,In Progress,Revenue Growth,Nirali Patel,admin,G000120,Develop and launch a new premium service offering to increase subscription revenue by 20% within the next fiscal year.
2022-07-23,Medium,Employee Turnover Rate,95,Marketing,68,2023-01-16,In Progress,Efficiency,Zane Sulikowski,admin,G000121,"Increase the overall efficiency of the IT support team by automating the ticketing system, aiming to reduce the average response time by 30% within the next quarter."
2022-03-02,Critical,Sales Increase,57,HR,39,2022-07-23,In Progress,Revenue Growth,Alejandra Prenatt,admin,G000122,Develop new regional markets to increase overall company revenue by 20% over the next fiscal year.
2022-08-12,Critical,Sales Increase,84,IT,78,2023-01-10,In Progress,Revenue Growth,Derek Kreutzbender,admin,G000123,Develop and launch a new software product line aimed at small businesses to increase overall revenue by 20% within the next fiscal year.
2022-08-15,Medium,Expense Ratio,89,IT,97,2022-09-13,Completed,Cost Reduction,Hilario Cassa,admin,G000124,"Reduce IT operational expenses by optimizing server utilization and adopting cloud services, targeting a cost reduction of 20% over the next fiscal year."
2022-02-05,Critical,Employee Turnover Rate,80,Finance,57,2022-04-01,In Progress,Cost Reduction,Pierre Salera,admin,G000125,"Reduce overall IT spend by optimizing software licensing agreements, aiming for a 20% cost saving within the next fiscal year."
2022-10-19,Medium,Survey Score,97,Marketing,91,2023-01-10,Planned,Employee Satisfaction,Elmo Gabouer,admin,G000126,"Develop and initiate a quarterly feedback mechanism to enhance employee satisfaction, aiming for a 20% improvement in satisfaction survey scores by the end of the year."
2022-01-20,Low,Employee Turnover Rate,64,Marketing,91,2022-08-01,Completed,Efficiency,Gisela Kosicki,admin,G000127,"Optimize IT support workflows to reduce average ticket resolution time by 30%, aiming to improve overall operational efficiency."
2022-04-25,Medium,Employee Turnover Rate,86,IT,75,2022-12-18,In Progress,Revenue Growth,Antony Thierauf,admin,G000128,Develop and launch a new software product line aimed at small businesses to increase overall company revenues by 20% within the next fiscal year.
2022-06-14,High,Expense Ratio,71,Finance,100,2023-01-18,Completed,Revenue Growth,Thomas Jefferson,admin,G000129,Expand into the European market to increase annual revenue by 20% through strategic partnerships and localized marketing strategies.
2022-09-29,Low,Employee Turnover Rate,92,IT,16,2023-02-24,Cancelled,Efficiency,Veronica Radman,admin,G000130,"Optimize team workflows by introducing automation tools, aiming to reduce manual data entry by 30% within the next quarter."
2022-03-21,Medium,Expense Ratio,63,IT,25,2022-07-12,In Progress,Revenue Growth,Sophie Langner,admin,G000131,Develop new market segments in the Asia-Pacific region aiming to increase overall sales revenue by 20% within the next fiscal year.
2022-08-21,Low,Survey Score,67,Marketing,80,2022-12-28,Completed,Efficiency,Denice Nordlinger,admin,G000132,"Optimize the IT support ticket system to decrease resolution times by 30%, enhancing overall operational efficiency."
2022-12-22,Low,Sales Increase,61,Finance,8,2023-01-09,In Progress,Cost Reduction,Allyson Gillispie,admin,G000133,Optimize IT service delivery workflows to achieve a 20% reduction in operating costs over the next fiscal year.
2022-03-29,Critical,Survey Score,74,IT,2,2022-11-07,In Progress,Revenue Growth,Karen Flierl,admin,G000134,Develop and launch a new premium service line designed to increase overall revenue by 20% in the next fiscal year.
2022-12-03,High,Expense Ratio,72,Marketing,54,2023-09-13,In Progress,Efficiency,Eva Seahorn,admin,G000135,"Increase the automation of report generation to reduce manual effort by 30%, thus improving overall process efficiency."
2022-09-05,Medium,Survey Score,92,HR,44,2022-10-12,Cancelled,Cost Reduction,Antony Thierauf,admin,G000136,Reduce overall IT operational costs by 20% through the adoption of automated tools and resource optimization.
2022-11-21,Low,Employee Turnover Rate,81,HR,61,2022-12-03,Cancelled,Cost Reduction,Peggy Hohlstein,admin,G000137,"Reduce overall IT spending by consolidating vendor contracts and optimizing software licensing agreements, aiming for a 20% reduction in expenses over the next fiscal year."
2022-01-14,Low,Expense Ratio,56,Marketing,93,2022-09-12,Completed,Customer Satisfaction,Lora Lendor,admin,G000138,Develop a new customer feedback system to enhance service quality and achieve a 20% increase in customer satisfaction ratings by the end of the quarter.
2022-11-21,Medium,Expense Ratio,73,Marketing,18,2023-07-15,In Progress,Efficiency,Justina Dragaj,admin,G000139,"Enhance the response time of IT support by automating routine inquiries, aiming to improve efficiency by 30% over the next quarter."
2022-07-10,Medium,Sales Increase,84,Marketing,15,2022-09-08,In Progress,Cost Reduction,Melinda Carleton,admin,G000140,Reduce IT infrastructure expenses by 20% through optimized cloud service usage and renegotiating vendor contracts.
2022-11-16,Critical,Sales Increase,94,Finance,73,2022-12-03,In Progress,Cost Reduction,Tammie Schwartzwalde,admin,G000141,Reduce overall IT expenses by 20% by optimizing software licensing management and enhancing vendor negotiation strategies.
2022-11-18,Critical,Expense Ratio,99,IT,17,2023-01-07,In Progress,Cost Reduction,Derek Kreutzbender,admin,G000142,Initiate supplier contract renegotiations to achieve a 20% cost reduction in IT expenses by Q4.
2022-05-22,High,Employee Turnover Rate,65,HR,101,2022-12-02,Completed,Employee Satisfaction,Pierre Salera,admin,G000143,Launch a quarterly feedback survey program aimed at improving employee satisfaction rates by at least 20% over the next fiscal year.
2022-10-09,Medium,Employee Turnover Rate,80,Marketing,59,2023-06-05,In Progress,Employee Satisfaction,Christian Marnell,admin,G000144,Launch a quarterly employee satisfaction survey to identify improvement areas and increase overall satisfaction scores by 20% by the end of the year.
2022-06-12,Medium,Survey Score,75,HR,12,2023-01-25,In Progress,Employee Satisfaction,Elaine Renzi,admin,G000145,Develop a comprehensive employee wellness program aiming to improve overall staff satisfaction ratings by 20% over the next fiscal year.
2022-08-04,High,Survey Score,99,Marketing,70,2022-11-26,Cancelled,Customer Satisfaction,Mamie Mcintee,admin,G000146,Enhance the customer support portal to improve user experience and increase customer satisfaction ratings by at least 20% over the next fiscal year.
2022-03-03,Critical,Expense Ratio,70,Finance,29,2022-02-23,In Progress,Revenue Growth,Kathleen Beresnyak,admin,G000147,Develop new regional sales strategies to increase overall revenue by 20% in the next fiscal year.
2022-12-11,High,Survey Score,58,Finance,30,2022-12-21,In Progress,Cost Reduction,Misty Ericksen,admin,G000148,"Optimize IT infrastructure to decrease operating expenses by 20%, aiming for a savings of $50K per quarter."
2022-05-19,High,Employee Turnover Rate,96,Finance,86,2022-09-25,Planned,Efficiency,Sean Bonnet,admin,G000149,Increase the automation of routine IT tasks from 40% to 60% to improve overall operational efficiency.
2022-03-27,Critical,Employee Turnover Rate,85,Finance,79,2022-04-22,Cancelled,Cost Reduction,Antony Thierauf,admin,G000150,"Reduce overall IT spending by consolidating vendor contracts and employing stricter budget controls, aiming for a 20% cost reduction within the next fiscal year."
2022-11-21,Low,Employee Turnover Rate,89,IT,94,2023-01-10,Completed,Cost Reduction,Doug Matrisciano,admin,G000151,Achieve a 20% reduction in overall IT spending by negotiating better vendor contracts and optimizing software licenses.
2022-11-08,Low,Expense Ratio,67,Finance,15,2023-05-10,In Progress,Customer Satisfaction,Mara Vanderzwaag,admin,G000152,Increase customer satisfaction scores by 20% through improved response times and enhanced support training programs.
2022-02-23,Critical,Employee Turnover Rate,56,Finance,34,2022-06-02,In Progress,Efficiency,Marcelino Maggs,admin,G000153,Optimize workflow automation to increase processing speed by 30% and reduce manual task intervention by 50%.
2022-09-12,Low,Sales Increase,93,Finance,31,2023-04-30,Planned,Employee Satisfaction,Henrietta Cintora,admin,G000154,Develop a comprehensive wellness program aimed at improving overall employee satisfaction scores by 20% within the next fiscal year.
2022-08-04,Medium,Expense Ratio,65,Marketing,77,2023-02-24,Completed,Revenue Growth,Adela Cervantsz,admin,G000155,Develop and launch a new software product to increase annual subscription revenue by 20%.
2022-12-14,Medium,Employee Turnover Rate,59,Finance,29,2023-04-10,Cancelled,Efficiency,Problem Administrator,admin,G000156,Increase the efficiency of customer support by reducing average response time from 24 hours to 8 hours within the next 6 months.
2022-05-09,Medium,Survey Score,81,Finance,6,2022-06-08,In Progress,Cost Reduction,Beverley Bunche,admin,G000157,Reduce overall IT expenditure by consolidating vendor contracts and achieving a 20% reduction in software licensing fees over the next fiscal year.
2022-11-03,Low,Expense Ratio,92,IT,44,2023-02-22,Planned,Employee Satisfaction,Vanessa Lewallen,admin,G000158,"Increase employee satisfaction scores by launching a new wellness program that includes flexible working hours and mental health support services, aiming for a 20% improvement in the annual employee survey."
2022-01-03,Medium,Survey Score,80,Finance,79,2022-02-26,In Progress,Cost Reduction,Dwayne Maddalena,admin,G000159,Reduce IT overhead expenses by 20% by optimizing cloud infrastructure usage and renegotiating vendor contracts.
2022-03-20,Critical,Employee Turnover Rate,93,IT,92,2022-08-23,In Progress,Employee Satisfaction,Dwayne Maddalena,admin,G000160,Develop and implement a quarterly team-building program to enhance employee satisfaction and reduce turnover by 20%.
2022-04-13,Critical,Sales Increase,99,IT,6,2022-05-16,In Progress,Cost Reduction,Dwain Cuttitta,admin,G000161,"Reduce overall IT infrastructure cost by optimizing cloud usage and renegotiating vendor contracts, aiming for a 20% cost saving within the next fiscal year."
2022-04-29,Low,Survey Score,88,Finance,51,2022-06-22,Cancelled,Cost Reduction,Peggy Hohlstein,admin,G000162,"Optimize IT infrastructure to lower operational costs by 20%, aiming to save approximately $50,000 annually."
2022-05-02,Critical,Employee Turnover Rate,50,Marketing,10,2022-09-20,Cancelled,Efficiency,survey user,admin,G000163,"Enhance the efficiency of the IT support process by automating routine queries, aiming to reduce response time by 30% within the next quarter."
2022-01-12,High,Expense Ratio,59,Finance,95,2022-02-28,Completed,Cost Reduction,Joey Sedore,admin,G000164,Achieve a 10% reduction in IT operational expenses by optimizing software license management and consolidating underutilized resources.
2022-11-03,High,Sales Increase,58,HR,25,2023-07-17,In Progress,Revenue Growth,Suresh Yekollu,admin,G000165,Develop and roll out a new online sales platform to increase overall revenue by 20% in the next financial year.
2022-03-28,Medium,Employee Turnover Rate,70,Marketing,23,2022-06-26,Cancelled,Revenue Growth,Dwain Cuttitta,admin,G000166,"Develop new partnerships to increase sales channels by 30%, aiming to enhance overall revenue growth in the next fiscal year."
2022-11-15,Critical,Employee Turnover Rate,68,Finance,81,2023-06-05,Completed,Employee Satisfaction,Dwain Cuttitta,admin,G000167,Increase employee satisfaction scores by implementing a flexible work schedule program that aims to improve work-life balance by the end of Q2.
2022-07-17,Low,Employee Turnover Rate,56,Finance,36,2023-01-26,In Progress,Customer Satisfaction,Krystle Stika,admin,G000168,Increase the customer satisfaction rating by 20% by the end of Q4 through improved response times and personalized support interactions.
2022-05-16,Critical,Survey Score,75,IT,66,2022-12-07,In Progress,Customer Satisfaction,Lora Lendor,admin,G000169,"Increase customer satisfaction ratings through enhanced support services and faster response times, aiming for a 20% improvement in our customer feedback scores."
2022-06-30,Low,Sales Increase,56,HR,60,2023-02-09,Completed,Efficiency,Lucas Santellana,admin,G000170,Optimize the IT support ticket system to reduce average resolution time by 20% within the next quarter.
2022-11-09,Critical,Survey Score,93,Marketing,6,2022-11-20,In Progress,Cost Reduction,Rich Gleave,admin,G000171,"Initiate supplier negotiations to achieve a 20% reduction in operational expenses by end of Q3, aiming to decrease spending from $500K to $400K."
2022-05-31,Critical,Employee Turnover Rate,86,Finance,11,2022-07-04,Planned,Cost Reduction,Dwain Cuttitta,admin,G000172,Achieve a 20% reduction in operational expenses by optimizing IT infrastructure and renegotiating vendor contracts.
2022-04-26,High,Employee Turnover Rate,92,HR,15,2022-12-19,In Progress,Employee Satisfaction,Kathleen Beresnyak,admin,G000173,"Develop and deploy an employee satisfaction survey by Q2 to identify areas of improvement, aiming to enhance workplace environment and increase overall employee satisfaction scores by 20% from the previous year."
2022-08-20,Medium,Sales Increase,83,Finance,62,2022-10-04,In Progress,Cost Reduction,Mildred Gallegas,admin,G000174,"Reduce overall IT infrastructure costs by consolidating vendors and negotiating more favorable terms, aiming for a 20% cost reduction within the next fiscal year."
2022-09-19,Critical,Sales Increase,77,Finance,92,2022-09-30,Completed,Cost Reduction,Geri Forness,admin,G000175,"Reduce organizational expenses by consolidating supplier contracts, targeting a 20% cost savings over the next fiscal year."
2022-07-27,Low,Employee Turnover Rate,79,Finance,48,2022-09-13,In Progress,Cost Reduction,Mamie Mcintee,admin,G000176,Achieve a 20% reduction in operational expenses by optimizing energy consumption across all company facilities.
2022-03-14,Low,Survey Score,88,Finance,101,2022-04-05,Completed,Cost Reduction,Certification User,admin,G000177,"Optimize IT asset utilization to decrease operational expenditure by 20%, aiming to save $500K annually."
2022-11-21,Critical,Survey Score,59,Marketing,93,2023-06-01,Completed,Employee Satisfaction,Tammie Schwartzwalde,admin,G000178,Increase employee engagement scores by 20% by introducing flexible work hours and enhancing remote work support systems.
2022-11-13,Critical,Employee Turnover Rate,97,Finance,33,2022-12-24,In Progress,Cost Reduction,Christian Marnell,admin,G000179,"Introduce automated software solutions to decrease IT operational expenses by 20%, aiming to save $50K annually."
2022-05-03,High,Survey Score,98,Finance,90,2022-06-08,In Progress,Cost Reduction,Maurine Monroy,admin,G000180,"Reduce software licensing expenses by negotiating multi-year contracts, aiming for a 20% reduction over the next fiscal year."
2022-06-18,High,Sales Increase,96,Finance,56,2022-12-27,In Progress,Employee Satisfaction,Alfonso Griglen,admin,G000181,"Design and execute a quarterly employee engagement survey to assess overall satisfaction and identify improvement areas, aiming to enhance employee retention rates by 20%."
2022-12-02,High,Expense Ratio,57,Finance,41,2023-07-07,In Progress,Efficiency,Lucius Bagnoli,admin,G000182,Enhance the automated support system to reduce average issue resolution time from 48 hours to 24 hours.
2022-11-19,Critical,Employee Turnover Rate,71,HR,67,2023-05-18,In Progress,Revenue Growth,Stephen Seiters,admin,G000183,"Expand sales territory into three new regions to increase annual revenue by 20%, aiming to exceed the $5 million mark."
2022-10-11,Critical,Employee Turnover Rate,85,Finance,101,2022-11-02,Completed,Cost Reduction,Carmel Overfelt,admin,G000184,"Introduce automation in invoice processing to decrease operational expenses by 20%, aiming to save approximately $120K annually."
2022-04-13,Critical,Expense Ratio,80,Finance,17,2022-11-18,In Progress,Employee Satisfaction,Nelly Jakuboski,admin,G000185,Develop and implement a quarterly team-building program aimed at increasing employee satisfaction ratings by 20% over the next fiscal year.
2022-05-29,Low,Expense Ratio,52,HR,65,2023-01-15,Completed,Employee Satisfaction,Marcelino Maggs,admin,G000186,Develop and implement a quarterly team-building program aimed at boosting employee morale and increasing overall job satisfaction ratings by 20%.
2022-06-15,Low,Survey Score,84,Finance,85,2022-12-03,Completed,Revenue Growth,Christa Bodenschatz,admin,G000187,Increase the annual sales revenue by 20% through enhanced marketing strategies and product line expansions.
2022-04-30,Medium,Survey Score,52,IT,23,2023-01-10,In Progress,Customer Satisfaction,Sandra Graen,admin,G000188,"Develop a new customer feedback system to enhance response rates by 30%, aiming to improve overall service satisfaction scores by the end of Q4."
2022-10-03,High,Sales Increase,100,Marketing,100,2022-10-03,Completed,Efficiency,survey user,admin,G000189,"Optimize IT support workflows to improve response times by 30%, enhancing overall operational efficiency."
2022-09-24,Medium,Expense Ratio,82,Finance,82,2022-11-17,Completed,Cost Reduction,Manifah Masood,admin,G000190,Reduce IT overhead expenses by 20% by optimizing software licensing agreements and minimizing redundant tool usage.
2022-10-19,High,Sales Increase,75,Finance,11,2022-11-26,In Progress,Cost Reduction,Valerie Pou,admin,G000191,Achieve a 20% decrease in operational expenses by optimizing energy usage and renegotiating supplier contracts by the end of Q4.
2022-03-11,Medium,Expense Ratio,63,Finance,62,2022-09-14,In Progress,Efficiency,Rosalia Kennemur,admin,G000192,"Increase the automation of routine database maintenance tasks by 30%, reducing average handling time from 2 hours to 1.4 hours per task."
2022-11-16,High,Expense Ratio,92,Finance,100,2023-06-01,Completed,Employee Satisfaction,Lora Lendor,admin,G000193,Develop a comprehensive wellness program aimed at improving work-life balance and overall employee satisfaction scores by 20% within the next fiscal year.
2022-11-23,High,Sales Increase,66,IT,47,2023-01-08,Cancelled,Cost Reduction,Timothy Janski,admin,G000194,"Reduce overall IT maintenance costs by optimizing vendor contracts, aiming for a 20% cost saving in the next fiscal year."
2022-05-04,Critical,Expense Ratio,65,Finance,79,2022-06-24,Completed,Cost Reduction,Karyn Jinks,admin,G000195,Reduce operational expenses by optimizing the use of third-party services and renegotiating existing contracts to achieve a 20% cost saving within the next fiscal year.
2022-12-30,Low,Survey Score,92,HR,76,2023-06-08,In Progress,Employee Satisfaction,Dwayne Maddalena,admin,G000196,Launch a quarterly employee feedback survey to enhance engagement and implement at least three major suggestions by the end of the year to improve overall employee satisfaction ratings by 20%.
2022-02-06,High,Expense Ratio,60,Finance,24,2022-03-12,In Progress,Cost Reduction,Renae Eldrige,admin,G000197,Reduce overall software licensing expenses by 20% through renegotiating vendor contracts and removing underutilized subscriptions.
2022-09-09,Medium,Expense Ratio,95,Finance,45,2023-01-28,In Progress,Revenue Growth,Dwain Cuttitta,admin,G000198,Expand market share by 20% through strategic partnerships and improved online marketing strategies aiming for a revenue increase from $500K to $600K.
2022-02-04,High,Survey Score,99,Finance,26,2022-06-24,In Progress,Employee Satisfaction,Nelly Jakuboski,admin,G000199,Develop a new company-wide survey and feedback system to effectively measure and enhance employee satisfaction by 30% within the next fiscal year.
2022-09-03,High,Survey Score,72,IT,17,2023-04-25,In Progress,Employee Satisfaction,Henrietta Cintora,admin,G000200,Develop and execute an improved employee engagement program aimed at boosting workplace satisfaction scores by 20% through quarterly team-building events and enhanced communication strategies.
2022-01-10,Critical,Expense Ratio,89,HR,62,2022-06-16,Cancelled,Employee Satisfaction,Karyn Jinks,admin,G000201,Initiate quarterly team-building activities to enhance team cohesion and improve overall employee satisfaction ratings by 20%.
2022-09-04,Medium,Expense Ratio,52,IT,61,2023-03-25,Completed,Revenue Growth,Bryant Bouliouris,admin,G000202,Introduce new cloud storage solutions to achieve a 20% increase in subscriber base and a 30% growth in annual revenue.
2022-01-09,Critical,Survey Score,86,Marketing,96,2022-11-11,Completed,Efficiency,Sean Bonnet,admin,G000203,Optimize internal workflow to improve overall operational efficiency by reducing task execution time by 20% in the upcoming quarter.
2022-02-19,High,Survey Score,63,HR,73,2022-10-26,Completed,Customer Satisfaction,Alejandra Prenatt,admin,G000204,Develop a customer feedback system to improve satisfaction ratings by 20% through more direct engagement and faster resolution times.
2022-08-27,Medium,Survey Score,82,Finance,21,2022-10-15,Planned,Cost Reduction,Zane Sulikowski,admin,G000205,Enhance supplier negotiation strategies to achieve a 20% reduction in operating expenses over the next fiscal quarter.
2022-11-27,Low,Survey Score,69,Finance,19,2023-01-03,In Progress,Cost Reduction,Lora Lendor,admin,G000206,"Reduce operating expenses by optimizing the utilization of IT resources, aiming for a cost reduction of 20% over the next fiscal year."
